ActivityID,JobSeekerID,OrganizationName,EAJobRole,EATimeRange,EADescription
1,418,"Torp, Swaniawski and Keebler",Automation Specialist II,1,"Vestibulum ac est lacinia nisi venenatis tristique. Fusce congue, diam id ornare imperdiet, sapien urna pretium nisl, ut volutpat sapien arcu sed augue. Aliquam erat volutpat."
2,34,Bergnaum LLC,Tax Accountant,5,"Sed sagittis. Nam congue, risus semper porta volutpat, quam pede lobortis ligula, sit amet eleifend pede libero quis orci. Nullam molestie nibh in lectus."
3,671,Stehr LLC,Mechanical Systems Engineer,6,Pellentesque at nulla. Suspendisse potenti. Cras in purus eu magna vulputate luctus.
4,606,"Cremin, Lakin and Sporer",Junior Executive,3,"Nam ultrices, libero non mattis pulvinar, nulla pede ullamcorper augue, a suscipit nulla elit ac nulla. Sed vel enim sit amet nunc viverra dapibus. Nulla suscipit ligula in lacus."
5,111,Kirlin-Skiles,Software Consultant,6,Aliquam quis turpis eget elit sodales scelerisque. Mauris sit amet eros. Suspendisse accumsan tortor quis turpis.
6,154,Little-Medhurst,Internal Auditor,5,In hac habitasse platea dictumst. Etiam faucibus cursus urna. Ut tellus.
7,869,Jast LLC,Sales Associate,2,"Aenean fermentum. Donec ut mauris eget massa tempor convallis. Nulla neque libero, convallis eget, eleifend luctus, ultricies eu, nibh."
8,851,Rippin LLC,Administrative Officer,1,In quis justo. Maecenas rhoncus aliquam lacus. Morbi quis tortor id nulla ultrices aliquet.
9,792,"Krajcik, Muller and Becker",Account Representative I,6,Aenean lectus. Pellentesque eget nunc. Donec quis orci eget orci vehicula condimentum.
10,380,Bruen-Fisher,Recruiting Manager,5,"Proin leo odio, porttitor id, consequat in, consequat ut, nulla. Sed accumsan felis. Ut at dolor quis odio consequat varius."
11,891,Legros-Smith,Database Administrator III,3,"Duis bibendum, felis sed interdum venenatis, turpis enim blandit mi, in porttitor pede justo eu massa. Donec dapibus. Duis at velit eu est congue elementum."
12,172,Rodriguez and Sons,Marketing Assistant,5,"Nam ultrices, libero non mattis pulvinar, nulla pede ullamcorper augue, a suscipit nulla elit ac nulla. Sed vel enim sit amet nunc viverra dapibus. Nulla suscipit ligula in lacus."
13,515,"Bernhard, McKenzie and Bechtelar",Nuclear Power Engineer,4,"Proin leo odio, porttitor id, consequat in, consequat ut, nulla. Sed accumsan felis. Ut at dolor quis odio consequat varius."
14,343,Bogan-Sauer,Nurse Practicioner,6,Fusce consequat. Nulla nisl. Nunc nisl.
15,911,Balistreri Inc,Actuary,5,In hac habitasse platea dictumst. Etiam faucibus cursus urna. Ut tellus.
16,681,Deckow-McDermott,Payment Adjustment Coordinator,5,"Maecenas leo odio, condimentum id, luctus nec, molestie sed, justo. Pellentesque viverra pede ac diam. Cras pellentesque volutpat dui."
17,150,Kling Inc,Analyst Programmer,2,Integer tincidunt ante vel ipsum. Praesent blandit lacinia erat. Vestibulum sed magna at nunc commodo placerat.
18,105,Oberbrunner-Reichert,Community Outreach Specialist,5,Nulla ut erat id mauris vulputate elementum. Nullam varius. Nulla facilisi.
19,304,"Carter, Roberts and Schuppe",Product Engineer,3,"Curabitur at ipsum ac tellus semper interdum. Mauris ullamcorper purus sit amet nulla. Quisque arcu libero, rutrum ac, lobortis vel, dapibus at, diam."
20,586,"Pagac, Weber and Satterfield",Project Manager,2,"Duis bibendum, felis sed interdum venenatis, turpis enim blandit mi, in porttitor pede justo eu massa. Donec dapibus. Duis at velit eu est congue elementum."
21,552,Medhurst-Moore,Executive Secretary,4,"In hac habitasse platea dictumst. Morbi vestibulum, velit id pretium iaculis, diam erat fermentum justo, nec condimentum neque sapien placerat ante. Nulla justo."
22,4,Trantow LLC,Geological Engineer,1,"Lorem ipsum dolor sit amet, consectetuer adipiscing elit. Proin risus. Praesent lectus."
23,16,Luettgen-Kihn,Director of Sales,5,"In hac habitasse platea dictumst. Morbi vestibulum, velit id pretium iaculis, diam erat fermentum justo, nec condimentum neque sapien placerat ante. Nulla justo."
24,422,"Willms, Trantow and Bartell",Office Assistant IV,1,Aenean lectus. Pellentesque eget nunc. Donec quis orci eget orci vehicula condimentum.
25,260,"Boehm, Waelchi and Bartoletti",Programmer Analyst III,4,Aenean lectus. Pellentesque eget nunc. Donec quis orci eget orci vehicula condimentum.
26,539,"Schuppe, Towne and Pfannerstill",Programmer II,6,Integer ac leo. Pellentesque ultrices mattis odio. Donec vitae nisi.
27,677,Runte-Daugherty,Physical Therapy Assistant,1,"Vestibulum quam sapien, varius ut, blandit non, interdum in, ante. Vestibulum ante ipsum primis in faucibus orci luctus et ultrices posuere cubilia Curae; Duis faucibus accumsan odio. Curabitur convallis."
28,960,"Rogahn, Roberts and Ernser",Accounting Assistant IV,1,"Sed sagittis. Nam congue, risus semper porta volutpat, quam pede lobortis ligula, sit amet eleifend pede libero quis orci. Nullam molestie nibh in lectus."
29,356,Hilpert-Kemmer,Operator,5,"Curabitur gravida nisi at nibh. In hac habitasse platea dictumst. Aliquam augue quam, sollicitudin vitae, consectetuer eget, rutrum at, lorem."
30,947,Fisher-Gerhold,Office Assistant II,2,"Curabitur at ipsum ac tellus semper interdum. Mauris ullamcorper purus sit amet nulla. Quisque arcu libero, rutrum ac, lobortis vel, dapibus at, diam."
31,464,Gutkowski-Bosco,Research Associate,4,"Lorem ipsum dolor sit amet, consectetuer adipiscing elit. Proin risus. Praesent lectus."
32,125,Paucek LLC,Recruiter,6,"Donec diam neque, vestibulum eget, vulputate ut, ultrices vel, augue. Vestibulum ante ipsum primis in faucibus orci luctus et ultrices posuere cubilia Curae; Donec pharetra, magna vestibulum aliquet ultrices, erat tortor sollicitudin mi, sit amet lobortis sapien sapien non mi. Integer ac neque."
33,939,"Jacobs, Sawayn and Kautzer",Pharmacist,2,"Curabitur gravida nisi at nibh. In hac habitasse platea dictumst. Aliquam augue quam, sollicitudin vitae, consectetuer eget, rutrum at, lorem."
34,567,Blick-Romaguera,Research Nurse,4,In quis justo. Maecenas rhoncus aliquam lacus. Morbi quis tortor id nulla ultrices aliquet.
35,790,"Spencer, Labadie and Larkin",Software Engineer III,3,Phasellus in felis. Donec semper sapien a libero. Nam dui.
36,137,Rippin Group,Dental Hygienist,2,"Maecenas tristique, est et tempus semper, est quam pharetra magna, ac consequat metus sapien ut nunc. Vestibulum ante ipsum primis in faucibus orci luctus et ultrices posuere cubilia Curae; Mauris viverra diam vitae quam. Suspendisse potenti."
37,113,"Wehner, Barton and Kris",Technical Writer,4,"Curabitur in libero ut massa volutpat convallis. Morbi odio odio, elementum eu, interdum eu, tincidunt in, leo. Maecenas pulvinar lobortis est."
38,491,"Goodwin, Veum and Bergstrom",Environmental Specialist,6,Fusce consequat. Nulla nisl. Nunc nisl.
39,361,Sauer Group,Data Coordinator,2,Integer ac leo. Pellentesque ultrices mattis odio. Donec vitae nisi.
40,247,"Gusikowski, Willms and Hilll",Geological Engineer,6,Nullam porttitor lacus at turpis. Donec posuere metus vitae ipsum. Aliquam non mauris.
41,444,"Hilll, Cummerata and Homenick",Geologist IV,2,Suspendisse potenti. In eleifend quam a odio. In hac habitasse platea dictumst.
42,806,"Spinka, Schumm and O'Kon",Recruiting Manager,4,Praesent id massa id nisl venenatis lacinia. Aenean sit amet justo. Morbi ut odio.
43,47,Cremin and Sons,Human Resources Assistant III,1,Phasellus sit amet erat. Nulla tempus. Vivamus in felis eu sapien cursus vestibulum.
44,179,Kiehn-Ryan,Compensation Analyst,3,Sed ante. Vivamus tortor. Duis mattis egestas metus.
45,306,Gusikowski LLC,Office Assistant IV,1,"Maecenas leo odio, condimentum id, luctus nec, molestie sed, justo. Pellentesque viverra pede ac diam. Cras pellentesque volutpat dui."
46,350,Spencer and Sons,Payment Adjustment Coordinator,5,Nulla ut erat id mauris vulputate elementum. Nullam varius. Nulla facilisi.
47,354,"Johns, Will and Ledner",GIS Technical Architect,4,"Aenean fermentum. Donec ut mauris eget massa tempor convallis. Nulla neque libero, convallis eget, eleifend luctus, ultricies eu, nibh."
48,416,Rowe Inc,Registered Nurse,5,In quis justo. Maecenas rhoncus aliquam lacus. Morbi quis tortor id nulla ultrices aliquet.
49,516,"Connelly, Parker and Wilkinson",Librarian,4,In quis justo. Maecenas rhoncus aliquam lacus. Morbi quis tortor id nulla ultrices aliquet.
50,203,Rohan Inc,Assistant Professor,2,"Proin leo odio, porttitor id, consequat in, consequat ut, nulla. Sed accumsan felis. Ut at dolor quis odio consequat varius."
51,221,Rice-Bergstrom,Analog Circuit Design manager,5,Nulla ut erat id mauris vulputate elementum. Nullam varius. Nulla facilisi.
52,109,Walker-Zieme,Structural Engineer,4,Etiam vel augue. Vestibulum rutrum rutrum neque. Aenean auctor gravida sem.
53,636,Schumm Group,Nurse Practicioner,3,"Aenean fermentum. Donec ut mauris eget massa tempor convallis. Nulla neque libero, convallis eget, eleifend luctus, ultricies eu, nibh."
54,840,Ledner LLC,Senior Financial Analyst,2,"Aenean fermentum. Donec ut mauris eget massa tempor convallis. Nulla neque libero, convallis eget, eleifend luctus, ultricies eu, nibh."
55,264,Douglas-Gleason,Structural Analysis Engineer,6,"Fusce posuere felis sed lacus. Morbi sem mauris, laoreet ut, rhoncus aliquet, pulvinar sed, nisl. Nunc rhoncus dui vel sem."
56,455,Stamm-Hammes,VP Marketing,5,"Proin eu mi. Nulla ac enim. In tempor, turpis nec euismod scelerisque, quam turpis adipiscing lorem, vitae mattis nibh ligula nec sem."
57,556,"Little, West and Spinka",VP Quality Control,3,"Proin leo odio, porttitor id, consequat in, consequat ut, nulla. Sed accumsan felis. Ut at dolor quis odio consequat varius."
58,818,White-Boehm,Graphic Designer,6,"Curabitur gravida nisi at nibh. In hac habitasse platea dictumst. Aliquam augue quam, sollicitudin vitae, consectetuer eget, rutrum at, lorem."
59,723,Purdy-Schimmel,Executive Secretary,5,"Praesent blandit. Nam nulla. Integer pede justo, lacinia eget, tincidunt eget, tempus vel, pede."
60,754,McDermott-Jacobs,Statistician II,1,Cras non velit nec nisi vulputate nonummy. Maecenas tincidunt lacus at velit. Vivamus vel nulla eget eros elementum pellentesque.
61,280,Thiel and Sons,Community Outreach Specialist,6,Duis consequat dui nec nisi volutpat eleifend. Donec ut dolor. Morbi vel lectus in quam fringilla rhoncus.
62,466,VonRueden-Zieme,Web Developer II,2,"Donec diam neque, vestibulum eget, vulputate ut, ultrices vel, augue. Vestibulum ante ipsum primis in faucibus orci luctus et ultrices posuere cubilia Curae; Donec pharetra, magna vestibulum aliquet ultrices, erat tortor sollicitudin mi, sit amet lobortis sapien sapien non mi. Integer ac neque."
63,893,Nolan Inc,Pharmacist,6,"Proin leo odio, porttitor id, consequat in, consequat ut, nulla. Sed accumsan felis. Ut at dolor quis odio consequat varius."
64,964,Gorczany and Sons,Physical Therapy Assistant,6,"Mauris enim leo, rhoncus sed, vestibulum sit amet, cursus id, turpis. Integer aliquet, massa id lobortis convallis, tortor risus dapibus augue, vel accumsan tellus nisi eu orci. Mauris lacinia sapien quis libero."
65,19,"Luettgen, Sauer and Sawayn",Nurse Practicioner,4,"Aenean fermentum. Donec ut mauris eget massa tempor convallis. Nulla neque libero, convallis eget, eleifend luctus, ultricies eu, nibh."
66,382,Leuschke Group,Human Resources Assistant IV,4,"Praesent blandit. Nam nulla. Integer pede justo, lacinia eget, tincidunt eget, tempus vel, pede."
67,748,Heaney-Zboncak,Senior Developer,1,Fusce consequat. Nulla nisl. Nunc nisl.
68,594,Altenwerth and Sons,Director of Sales,5,"Cras mi pede, malesuada in, imperdiet et, commodo vulputate, justo. In blandit ultrices enim. Lorem ipsum dolor sit amet, consectetuer adipiscing elit."
69,837,"Hoppe, Crooks and Abshire",Legal Assistant,2,Aliquam quis turpis eget elit sodales scelerisque. Mauris sit amet eros. Suspendisse accumsan tortor quis turpis.
70,383,"Wolff, Purdy and Ferry",Registered Nurse,5,"Maecenas tristique, est et tempus semper, est quam pharetra magna, ac consequat metus sapien ut nunc. Vestibulum ante ipsum primis in faucibus orci luctus et ultrices posuere cubilia Curae; Mauris viverra diam vitae quam. Suspendisse potenti."
71,523,Gusikowski Group,GIS Technical Architect,3,Aliquam quis turpis eget elit sodales scelerisque. Mauris sit amet eros. Suspendisse accumsan tortor quis turpis.
72,200,Langworth LLC,Physical Therapy Assistant,6,Pellentesque at nulla. Suspendisse potenti. Cras in purus eu magna vulputate luctus.
73,956,Monahan Inc,Operator,3,"Curabitur at ipsum ac tellus semper interdum. Mauris ullamcorper purus sit amet nulla. Quisque arcu libero, rutrum ac, lobortis vel, dapibus at, diam."
74,952,Johnson-Thiel,Senior Quality Engineer,3,"Cras mi pede, malesuada in, imperdiet et, commodo vulputate, justo. In blandit ultrices enim. Lorem ipsum dolor sit amet, consectetuer adipiscing elit."
75,609,Schoen Inc,Database Administrator I,6,In congue. Etiam justo. Etiam pretium iaculis justo.
76,62,Lynch and Sons,Media Manager IV,2,In hac habitasse platea dictumst. Etiam faucibus cursus urna. Ut tellus.
77,757,Schulist-Schmitt,Associate Professor,6,Cras non velit nec nisi vulputate nonummy. Maecenas tincidunt lacus at velit. Vivamus vel nulla eget eros elementum pellentesque.
78,502,Auer-Effertz,Help Desk Operator,5,"Sed sagittis. Nam congue, risus semper porta volutpat, quam pede lobortis ligula, sit amet eleifend pede libero quis orci. Nullam molestie nibh in lectus."
79,287,Ratke-Auer,Junior Executive,5,In hac habitasse platea dictumst. Etiam faucibus cursus urna. Ut tellus.
80,198,Lindgren Group,GIS Technical Architect,3,Praesent id massa id nisl venenatis lacinia. Aenean sit amet justo. Morbi ut odio.
81,420,Cole Inc,Senior Developer,4,"Proin leo odio, porttitor id, consequat in, consequat ut, nulla. Sed accumsan felis. Ut at dolor quis odio consequat varius."
82,356,Labadie-Klein,Actuary,4,Phasellus sit amet erat. Nulla tempus. Vivamus in felis eu sapien cursus vestibulum.
83,188,"Nader, Lynch and Beier",Programmer Analyst I,3,"Curabitur gravida nisi at nibh. In hac habitasse platea dictumst. Aliquam augue quam, sollicitudin vitae, consectetuer eget, rutrum at, lorem."
84,515,"Wiza, Murazik and Lehner",Research Assistant III,6,Aenean lectus. Pellentesque eget nunc. Donec quis orci eget orci vehicula condimentum.
85,935,Schulist and Sons,Community Outreach Specialist,2,Phasellus sit amet erat. Nulla tempus. Vivamus in felis eu sapien cursus vestibulum.
86,130,Reilly-Hammes,Programmer Analyst III,2,"Quisque porta volutpat erat. Quisque erat eros, viverra eget, congue eget, semper rutrum, nulla. Nunc purus."
87,732,Mitchell Inc,Editor,3,"Proin eu mi. Nulla ac enim. In tempor, turpis nec euismod scelerisque, quam turpis adipiscing lorem, vitae mattis nibh ligula nec sem."
88,239,"Abbott, Goyette and Konopelski",Compensation Analyst,1,Cras non velit nec nisi vulputate nonummy. Maecenas tincidunt lacus at velit. Vivamus vel nulla eget eros elementum pellentesque.
89,680,Keeling-Wisoky,Sales Representative,2,"Proin interdum mauris non ligula pellentesque ultrices. Phasellus id sapien in sapien iaculis congue. Vivamus metus arcu, adipiscing molestie, hendrerit at, vulputate vitae, nisl."
90,635,McCullough Inc,Compensation Analyst,4,In hac habitasse platea dictumst. Etiam faucibus cursus urna. Ut tellus.
91,951,"Abshire, Waelchi and Hegmann",Software Engineer I,2,Cras non velit nec nisi vulputate nonummy. Maecenas tincidunt lacus at velit. Vivamus vel nulla eget eros elementum pellentesque.
92,112,Little-Kling,Senior Cost Accountant,3,"Cum sociis natoque penatibus et magnis dis parturient montes, nascetur ridiculus mus. Vivamus vestibulum sagittis sapien. Cum sociis natoque penatibus et magnis dis parturient montes, nascetur ridiculus mus."
93,184,Kuhn-Treutel,Geological Engineer,3,Phasellus in felis. Donec semper sapien a libero. Nam dui.
94,621,Heidenreich LLC,Internal Auditor,4,"Proin leo odio, porttitor id, consequat in, consequat ut, nulla. Sed accumsan felis. Ut at dolor quis odio consequat varius."
95,661,Kiehn and Sons,VP Accounting,4,"Quisque porta volutpat erat. Quisque erat eros, viverra eget, congue eget, semper rutrum, nulla. Nunc purus."
96,123,Mitchell Inc,Physical Therapy Assistant,6,"Proin interdum mauris non ligula pellentesque ultrices. Phasellus id sapien in sapien iaculis congue. Vivamus metus arcu, adipiscing molestie, hendrerit at, vulputate vitae, nisl."
97,674,"King, Gulgowski and Torphy",Automation Specialist IV,3,Suspendisse potenti. In eleifend quam a odio. In hac habitasse platea dictumst.
98,511,"Fay, Monahan and Kozey",Product Engineer,2,"Proin eu mi. Nulla ac enim. In tempor, turpis nec euismod scelerisque, quam turpis adipiscing lorem, vitae mattis nibh ligula nec sem."
99,570,Thompson-Schinner,Web Designer IV,5,Pellentesque at nulla. Suspendisse potenti. Cras in purus eu magna vulputate luctus.
100,744,Hyatt Inc,GIS Technical Architect,1,"Curabitur in libero ut massa volutpat convallis. Morbi odio odio, elementum eu, interdum eu, tincidunt in, leo. Maecenas pulvinar lobortis est."
101,185,Bashirian LLC,Senior Financial Analyst,1,Etiam vel augue. Vestibulum rutrum rutrum neque. Aenean auctor gravida sem.
102,406,Armstrong Inc,Environmental Specialist,6,"Fusce posuere felis sed lacus. Morbi sem mauris, laoreet ut, rhoncus aliquet, pulvinar sed, nisl. Nunc rhoncus dui vel sem."
103,971,"Raynor, McLaughlin and Hoeger",Editor,6,Fusce consequat. Nulla nisl. Nunc nisl.
104,841,"Boyer, Leannon and Ryan",Database Administrator IV,4,"Curabitur gravida nisi at nibh. In hac habitasse platea dictumst. Aliquam augue quam, sollicitudin vitae, consectetuer eget, rutrum at, lorem."
105,337,"Hammes, Bailey and Ward",Payment Adjustment Coordinator,1,Integer ac leo. Pellentesque ultrices mattis odio. Donec vitae nisi.
106,467,"Corwin, Kuhlman and Becker",Marketing Manager,2,Nulla ut erat id mauris vulputate elementum. Nullam varius. Nulla facilisi.
107,754,Ullrich Group,Software Test Engineer III,6,"Donec diam neque, vestibulum eget, vulputate ut, ultrices vel, augue. Vestibulum ante ipsum primis in faucibus orci luctus et ultrices posuere cubilia Curae; Donec pharetra, magna vestibulum aliquet ultrices, erat tortor sollicitudin mi, sit amet lobortis sapien sapien non mi. Integer ac neque."
108,693,Romaguera Inc,Senior Sales Associate,2,"Cras mi pede, malesuada in, imperdiet et, commodo vulputate, justo. In blandit ultrices enim. Lorem ipsum dolor sit amet, consectetuer adipiscing elit."
109,826,Klocko-Klocko,Financial Advisor,4,"Proin interdum mauris non ligula pellentesque ultrices. Phasellus id sapien in sapien iaculis congue. Vivamus metus arcu, adipiscing molestie, hendrerit at, vulputate vitae, nisl."
110,100,"Nicolas, Kirlin and Cole",Recruiting Manager,3,"Mauris enim leo, rhoncus sed, vestibulum sit amet, cursus id, turpis. Integer aliquet, massa id lobortis convallis, tortor risus dapibus augue, vel accumsan tellus nisi eu orci. Mauris lacinia sapien quis libero."
111,910,Abbott-Nikolaus,Assistant Manager,6,"Aenean fermentum. Donec ut mauris eget massa tempor convallis. Nulla neque libero, convallis eget, eleifend luctus, ultricies eu, nibh."
112,332,"Kohler, Kuhn and Kertzmann",Technical Writer,3,Pellentesque at nulla. Suspendisse potenti. Cras in purus eu magna vulputate luctus.
113,121,Gerlach-Lockman,Geological Engineer,6,Maecenas ut massa quis augue luctus tincidunt. Nulla mollis molestie lorem. Quisque ut erat.
114,825,"Gislason, Kunze and Connelly",Account Representative II,6,"Nam ultrices, libero non mattis pulvinar, nulla pede ullamcorper augue, a suscipit nulla elit ac nulla. Sed vel enim sit amet nunc viverra dapibus. Nulla suscipit ligula in lacus."
115,81,"Gibson, Dickens and Rath",Senior Cost Accountant,2,"Proin interdum mauris non ligula pellentesque ultrices. Phasellus id sapien in sapien iaculis congue. Vivamus metus arcu, adipiscing molestie, hendrerit at, vulputate vitae, nisl."
116,85,Jast-O'Hara,Senior Editor,3,"Vestibulum quam sapien, varius ut, blandit non, interdum in, ante. Vestibulum ante ipsum primis in faucibus orci luctus et ultrices posuere cubilia Curae; Duis faucibus accumsan odio. Curabitur convallis."
117,384,"Deckow, Deckow and Gislason",Software Test Engineer I,4,"Curabitur at ipsum ac tellus semper interdum. Mauris ullamcorper purus sit amet nulla. Quisque arcu libero, rutrum ac, lobortis vel, dapibus at, diam."
118,576,Langosh LLC,Software Engineer III,3,Nullam porttitor lacus at turpis. Donec posuere metus vitae ipsum. Aliquam non mauris.
119,478,Cole-Pollich,Environmental Tech,4,Duis bibendum. Morbi non quam nec dui luctus rutrum. Nulla tellus.
120,651,"Smith, Schamberger and Hyatt",Design Engineer,5,Cras non velit nec nisi vulputate nonummy. Maecenas tincidunt lacus at velit. Vivamus vel nulla eget eros elementum pellentesque.
121,503,Little Group,Environmental Specialist,5,"Cum sociis natoque penatibus et magnis dis parturient montes, nascetur ridiculus mus. Vivamus vestibulum sagittis sapien. Cum sociis natoque penatibus et magnis dis parturient montes, nascetur ridiculus mus."
122,699,Hansen and Sons,Executive Secretary,4,In quis justo. Maecenas rhoncus aliquam lacus. Morbi quis tortor id nulla ultrices aliquet.
123,735,Stokes-Anderson,Account Executive,4,Etiam vel augue. Vestibulum rutrum rutrum neque. Aenean auctor gravida sem.
124,803,"Harvey, Purdy and Welch",Assistant Manager,6,In congue. Etiam justo. Etiam pretium iaculis justo.
125,229,Jenkins Group,Administrative Officer,2,"Proin leo odio, porttitor id, consequat in, consequat ut, nulla. Sed accumsan felis. Ut at dolor quis odio consequat varius."
126,450,Ondricka-Wunsch,VP Product Management,4,"Proin eu mi. Nulla ac enim. In tempor, turpis nec euismod scelerisque, quam turpis adipiscing lorem, vitae mattis nibh ligula nec sem."
127,295,Bechtelar-Moore,Human Resources Assistant III,5,"Aenean fermentum. Donec ut mauris eget massa tempor convallis. Nulla neque libero, convallis eget, eleifend luctus, ultricies eu, nibh."
128,237,"Hettinger, Dietrich and Hilpert",Editor,1,"Proin leo odio, porttitor id, consequat in, consequat ut, nulla. Sed accumsan felis. Ut at dolor quis odio consequat varius."
129,463,Feeney LLC,Programmer I,6,"Proin leo odio, porttitor id, consequat in, consequat ut, nulla. Sed accumsan felis. Ut at dolor quis odio consequat varius."
130,390,Mills and Sons,Account Coordinator,3,Sed ante. Vivamus tortor. Duis mattis egestas metus.
131,585,Smitham-McDermott,Sales Associate,6,"Quisque porta volutpat erat. Quisque erat eros, viverra eget, congue eget, semper rutrum, nulla. Nunc purus."
132,740,Hilll LLC,Engineer I,6,"Curabitur in libero ut massa volutpat convallis. Morbi odio odio, elementum eu, interdum eu, tincidunt in, leo. Maecenas pulvinar lobortis est."
133,389,Streich and Sons,Database Administrator IV,3,In congue. Etiam justo. Etiam pretium iaculis justo.
134,475,Franecki LLC,Analog Circuit Design manager,3,Etiam vel augue. Vestibulum rutrum rutrum neque. Aenean auctor gravida sem.
135,728,Collier-Macejkovic,Safety Technician IV,2,"Proin eu mi. Nulla ac enim. In tempor, turpis nec euismod scelerisque, quam turpis adipiscing lorem, vitae mattis nibh ligula nec sem."
136,982,Kovacek-Block,Professor,4,"In hac habitasse platea dictumst. Morbi vestibulum, velit id pretium iaculis, diam erat fermentum justo, nec condimentum neque sapien placerat ante. Nulla justo."
137,329,Ratke-Hand,Account Coordinator,3,"Sed sagittis. Nam congue, risus semper porta volutpat, quam pede lobortis ligula, sit amet eleifend pede libero quis orci. Nullam molestie nibh in lectus."
138,20,"Hettinger, Strosin and Will",Director of Sales,4,"Maecenas tristique, est et tempus semper, est quam pharetra magna, ac consequat metus sapien ut nunc. Vestibulum ante ipsum primis in faucibus orci luctus et ultrices posuere cubilia Curae; Mauris viverra diam vitae quam. Suspendisse potenti."
139,467,"Muller, Fritsch and Altenwerth",Human Resources Manager,6,Nullam porttitor lacus at turpis. Donec posuere metus vitae ipsum. Aliquam non mauris.
140,213,"Wilkinson, Olson and Olson",Payment Adjustment Coordinator,2,Sed ante. Vivamus tortor. Duis mattis egestas metus.
141,703,Steuber-Stiedemann,Product Engineer,3,Cras non velit nec nisi vulputate nonummy. Maecenas tincidunt lacus at velit. Vivamus vel nulla eget eros elementum pellentesque.
142,971,Koss-Kassulke,Recruiting Manager,3,"Quisque porta volutpat erat. Quisque erat eros, viverra eget, congue eget, semper rutrum, nulla. Nunc purus."
143,493,Daniel and Sons,Librarian,1,"Morbi porttitor lorem id ligula. Suspendisse ornare consequat lectus. In est risus, auctor sed, tristique in, tempus sit amet, sem."
144,205,Leffler-Klein,Software Consultant,3,Nulla ut erat id mauris vulputate elementum. Nullam varius. Nulla facilisi.
145,763,Lang-Jacobs,Information Systems Manager,3,Cras non velit nec nisi vulputate nonummy. Maecenas tincidunt lacus at velit. Vivamus vel nulla eget eros elementum pellentesque.
146,986,VonRueden LLC,Teacher,6,"Proin interdum mauris non ligula pellentesque ultrices. Phasellus id sapien in sapien iaculis congue. Vivamus metus arcu, adipiscing molestie, hendrerit at, vulputate vitae, nisl."
147,528,Kilback and Sons,Data Coordinator,1,"Vestibulum quam sapien, varius ut, blandit non, interdum in, ante. Vestibulum ante ipsum primis in faucibus orci luctus et ultrices posuere cubilia Curae; Duis faucibus accumsan odio. Curabitur convallis."
148,907,Volkman Inc,Civil Engineer,2,"Aenean fermentum. Donec ut mauris eget massa tempor convallis. Nulla neque libero, convallis eget, eleifend luctus, ultricies eu, nibh."
149,74,Beahan Group,Director of Sales,1,"Vestibulum quam sapien, varius ut, blandit non, interdum in, ante. Vestibulum ante ipsum primis in faucibus orci luctus et ultrices posuere cubilia Curae; Duis faucibus accumsan odio. Curabitur convallis."
