ActivityID,JobSeekerID,OrganizationName,EAJobRole,EATimeRange,EADescription
301,141,"Prosacco, Herzog and Schmitt",Engineer II,5,Aenean lectus. Pellentesque eget nunc. Donec quis orci eget orci vehicula condimentum.
302,644,Borer Group,VP Marketing,5,"Mauris enim leo, rhoncus sed, vestibulum sit amet, cursus id, turpis. Integer aliquet, massa id lobortis convallis, tortor risus dapibus augue, vel accumsan tellus nisi eu orci. Mauris lacinia sapien quis libero."
303,840,Hills-McCullough,Account Executive,6,"Maecenas tristique, est et tempus semper, est quam pharetra magna, ac consequat metus sapien ut nunc. Vestibulum ante ipsum primis in faucibus orci luctus et ultrices posuere cubilia Curae; Mauris viverra diam vitae quam. Suspendisse potenti."
304,498,"Lebsack, Russel and Jaskolski",Social Worker,5,Aliquam quis turpis eget elit sodales scelerisque. Mauris sit amet eros. Suspendisse accumsan tortor quis turpis.
305,478,Streich Inc,Developer IV,1,In quis justo. Maecenas rhoncus aliquam lacus. Morbi quis tortor id nulla ultrices aliquet.
306,893,"Daniel, Mills and Botsford",Recruiter,4,"Donec diam neque, vestibulum eget, vulputate ut, ultrices vel, augue. Vestibulum ante ipsum primis in faucibus orci luctus et ultrices posuere cubilia Curae; Donec pharetra, magna vestibulum aliquet ultrices, erat tortor sollicitudin mi, sit amet lobortis sapien sapien non mi. Integer ac neque."
307,130,"Pollich, Legros and Senger",Compensation Analyst,2,"Proin interdum mauris non ligula pellentesque ultrices. Phasellus id sapien in sapien iaculis congue. Vivamus metus arcu, adipiscing molestie, hendrerit at, vulputate vitae, nisl."
308,417,"D'Amore, Schimmel and Schoen",Geological Engineer,4,"Cras mi pede, malesuada in, imperdiet et, commodo vulputate, justo. In blandit ultrices enim. Lorem ipsum dolor sit amet, consectetuer adipiscing elit."
309,615,Quitzon Group,Recruiter,5,Etiam vel augue. Vestibulum rutrum rutrum neque. Aenean auctor gravida sem.
310,829,Gutkowski Inc,Occupational Therapist,5,"Praesent blandit. Nam nulla. Integer pede justo, lacinia eget, tincidunt eget, tempus vel, pede."
311,83,Harvey Group,Civil Engineer,3,"Lorem ipsum dolor sit amet, consectetuer adipiscing elit. Proin risus. Praesent lectus."
312,307,Hermann-Goldner,Assistant Manager,4,"Praesent blandit. Nam nulla. Integer pede justo, lacinia eget, tincidunt eget, tempus vel, pede."
313,852,Goyette-Jast,Graphic Designer,3,Phasellus in felis. Donec semper sapien a libero. Nam dui.
314,67,Torphy-Herman,Graphic Designer,6,Nullam sit amet turpis elementum ligula vehicula consequat. Morbi a ipsum. Integer a nibh.
315,523,Blanda and Sons,Engineer I,5,"Quisque id justo sit amet sapien dignissim vestibulum. Vestibulum ante ipsum primis in faucibus orci luctus et ultrices posuere cubilia Curae; Nulla dapibus dolor vel est. Donec odio justo, sollicitudin ut, suscipit a, feugiat et, eros."
316,159,"Wehner, Gulgowski and Botsford",Legal Assistant,4,"Morbi non lectus. Aliquam sit amet diam in magna bibendum imperdiet. Nullam orci pede, venenatis non, sodales sed, tincidunt eu, felis."
317,71,Kohler-Hessel,Payment Adjustment Coordinator,1,"In sagittis dui vel nisl. Duis ac nibh. Fusce lacus purus, aliquet at, feugiat non, pretium quis, lectus."
318,508,Harvey Group,Speech Pathologist,1,In congue. Etiam justo. Etiam pretium iaculis justo.
319,405,Witting-Gislason,VP Product Management,1,Fusce consequat. Nulla nisl. Nunc nisl.
320,58,"Lesch, Satterfield and Pagac",Internal Auditor,5,"Morbi porttitor lorem id ligula. Suspendisse ornare consequat lectus. In est risus, auctor sed, tristique in, tempus sit amet, sem."
321,668,Kemmer-Hansen,Software Consultant,1,"Curabitur in libero ut massa volutpat convallis. Morbi odio odio, elementum eu, interdum eu, tincidunt in, leo. Maecenas pulvinar lobortis est."
322,21,Cruickshank-Boyer,Assistant Manager,1,"Cras mi pede, malesuada in, imperdiet et, commodo vulputate, justo. In blandit ultrices enim. Lorem ipsum dolor sit amet, consectetuer adipiscing elit."
323,755,"Maggio, Sanford and Bernhard",Account Representative III,4,"Proin eu mi. Nulla ac enim. In tempor, turpis nec euismod scelerisque, quam turpis adipiscing lorem, vitae mattis nibh ligula nec sem."
324,937,"Collier, Dach and Donnelly",GIS Technical Architect,3,"In hac habitasse platea dictumst. Morbi vestibulum, velit id pretium iaculis, diam erat fermentum justo, nec condimentum neque sapien placerat ante. Nulla justo."
325,78,"Rohan, Daugherty and Batz",Administrative Assistant II,4,Maecenas ut massa quis augue luctus tincidunt. Nulla mollis molestie lorem. Quisque ut erat.
326,724,McLaughlin LLC,Chief Design Engineer,5,Nulla ut erat id mauris vulputate elementum. Nullam varius. Nulla facilisi.
327,464,Daniel-Block,Nuclear Power Engineer,4,"Lorem ipsum dolor sit amet, consectetuer adipiscing elit. Proin risus. Praesent lectus."
328,344,Wisozk-Wyman,Physical Therapy Assistant,3,In quis justo. Maecenas rhoncus aliquam lacus. Morbi quis tortor id nulla ultrices aliquet.
329,505,Stamm-Bartoletti,Administrative Assistant IV,1,In congue. Etiam justo. Etiam pretium iaculis justo.
330,842,Marks Group,Nurse,3,"Maecenas leo odio, condimentum id, luctus nec, molestie sed, justo. Pellentesque viverra pede ac diam. Cras pellentesque volutpat dui."
331,949,"Crist, Stark and Nitzsche",Executive Secretary,5,Integer tincidunt ante vel ipsum. Praesent blandit lacinia erat. Vestibulum sed magna at nunc commodo placerat.
332,958,Tromp Inc,Community Outreach Specialist,1,"Curabitur gravida nisi at nibh. In hac habitasse platea dictumst. Aliquam augue quam, sollicitudin vitae, consectetuer eget, rutrum at, lorem."
333,273,Powlowski-Crist,Programmer II,1,"Proin eu mi. Nulla ac enim. In tempor, turpis nec euismod scelerisque, quam turpis adipiscing lorem, vitae mattis nibh ligula nec sem."
334,413,Gorczany-Fay,VP Accounting,5,"In sagittis dui vel nisl. Duis ac nibh. Fusce lacus purus, aliquet at, feugiat non, pretium quis, lectus."
335,5,Rempel Inc,Analog Circuit Design manager,4,Maecenas ut massa quis augue luctus tincidunt. Nulla mollis molestie lorem. Quisque ut erat.
336,929,"Ernser, Cruickshank and Tillman",Clinical Specialist,4,In hac habitasse platea dictumst. Etiam faucibus cursus urna. Ut tellus.
337,530,Skiles-Lind,Office Assistant I,2,"Curabitur at ipsum ac tellus semper interdum. Mauris ullamcorper purus sit amet nulla. Quisque arcu libero, rutrum ac, lobortis vel, dapibus at, diam."
338,967,Thiel-Reichert,Tax Accountant,5,Integer tincidunt ante vel ipsum. Praesent blandit lacinia erat. Vestibulum sed magna at nunc commodo placerat.
339,577,"Shanahan, Barton and Macejkovic",Engineer I,6,"Praesent blandit. Nam nulla. Integer pede justo, lacinia eget, tincidunt eget, tempus vel, pede."
340,19,Pacocha-Armstrong,Senior Editor,3,"Quisque porta volutpat erat. Quisque erat eros, viverra eget, congue eget, semper rutrum, nulla. Nunc purus."
341,841,Harvey Inc,Community Outreach Specialist,4,Duis bibendum. Morbi non quam nec dui luctus rutrum. Nulla tellus.
342,809,Waelchi-Larson,Chief Design Engineer,5,In quis justo. Maecenas rhoncus aliquam lacus. Morbi quis tortor id nulla ultrices aliquet.
343,128,Williamson-Christiansen,Geologist I,2,"Morbi porttitor lorem id ligula. Suspendisse ornare consequat lectus. In est risus, auctor sed, tristique in, tempus sit amet, sem."
344,613,Goyette LLC,Director of Sales,6,In hac habitasse platea dictumst. Etiam faucibus cursus urna. Ut tellus.
345,259,Donnelly and Sons,Staff Accountant II,6,"Lorem ipsum dolor sit amet, consectetuer adipiscing elit. Proin risus. Praesent lectus."
346,72,Wolf-Jacobs,Speech Pathologist,4,Integer ac leo. Pellentesque ultrices mattis odio. Donec vitae nisi.
347,811,Moore LLC,Assistant Media Planner,2,Phasellus sit amet erat. Nulla tempus. Vivamus in felis eu sapien cursus vestibulum.
348,501,"McCullough, Schaefer and O'Keefe",Staff Scientist,2,Pellentesque at nulla. Suspendisse potenti. Cras in purus eu magna vulputate luctus.
349,836,Buckridge-Hills,Payment Adjustment Coordinator,1,"Curabitur gravida nisi at nibh. In hac habitasse platea dictumst. Aliquam augue quam, sollicitudin vitae, consectetuer eget, rutrum at, lorem."
350,241,Lesch-Crooks,Senior Editor,3,"Curabitur gravida nisi at nibh. In hac habitasse platea dictumst. Aliquam augue quam, sollicitudin vitae, consectetuer eget, rutrum at, lorem."
351,310,Jast LLC,Senior Developer,6,Integer ac leo. Pellentesque ultrices mattis odio. Donec vitae nisi.
352,767,"Gleichner, Wiza and Price",Analog Circuit Design manager,2,Cras non velit nec nisi vulputate nonummy. Maecenas tincidunt lacus at velit. Vivamus vel nulla eget eros elementum pellentesque.
353,13,"Kohler, Mayert and Wiza",Junior Executive,2,"Proin leo odio, porttitor id, consequat in, consequat ut, nulla. Sed accumsan felis. Ut at dolor quis odio consequat varius."
354,793,"Beatty, Pouros and Moore",Operator,4,Duis consequat dui nec nisi volutpat eleifend. Donec ut dolor. Morbi vel lectus in quam fringilla rhoncus.
355,60,"Moen, Grimes and Boyer",Research Nurse,4,"In sagittis dui vel nisl. Duis ac nibh. Fusce lacus purus, aliquet at, feugiat non, pretium quis, lectus."
356,324,Considine-Padberg,Pharmacist,1,In congue. Etiam justo. Etiam pretium iaculis justo.
357,599,Orn-Medhurst,Legal Assistant,1,Integer tincidunt ante vel ipsum. Praesent blandit lacinia erat. Vestibulum sed magna at nunc commodo placerat.
358,660,Rosenbaum-Luettgen,Chemical Engineer,3,Maecenas ut massa quis augue luctus tincidunt. Nulla mollis molestie lorem. Quisque ut erat.
359,164,Wintheiser-Haag,Occupational Therapist,3,Etiam vel augue. Vestibulum rutrum rutrum neque. Aenean auctor gravida sem.
360,115,"Kertzmann, Sporer and Murray",Environmental Specialist,4,Aenean lectus. Pellentesque eget nunc. Donec quis orci eget orci vehicula condimentum.
361,519,"Tromp, Weissnat and Flatley",Structural Engineer,6,"Morbi non lectus. Aliquam sit amet diam in magna bibendum imperdiet. Nullam orci pede, venenatis non, sodales sed, tincidunt eu, felis."
362,824,Gibson and Sons,Help Desk Technician,5,"Proin eu mi. Nulla ac enim. In tempor, turpis nec euismod scelerisque, quam turpis adipiscing lorem, vitae mattis nibh ligula nec sem."
363,688,Mills and Sons,Project Manager,1,Aliquam quis turpis eget elit sodales scelerisque. Mauris sit amet eros. Suspendisse accumsan tortor quis turpis.
364,449,Bins-Smitham,Project Manager,1,In hac habitasse platea dictumst. Etiam faucibus cursus urna. Ut tellus.
365,405,"Bechtelar, Bosco and Wuckert",Sales Representative,1,"Curabitur at ipsum ac tellus semper interdum. Mauris ullamcorper purus sit amet nulla. Quisque arcu libero, rutrum ac, lobortis vel, dapibus at, diam."
366,144,Okuneva-Goodwin,Mechanical Systems Engineer,3,"Morbi non lectus. Aliquam sit amet diam in magna bibendum imperdiet. Nullam orci pede, venenatis non, sodales sed, tincidunt eu, felis."
367,731,Macejkovic LLC,Biostatistician IV,6,Duis bibendum. Morbi non quam nec dui luctus rutrum. Nulla tellus.
368,236,"Johns, O'Connell and Langworth",Marketing Manager,6,Phasellus in felis. Donec semper sapien a libero. Nam dui.
369,47,Bernier Inc,Speech Pathologist,6,Integer tincidunt ante vel ipsum. Praesent blandit lacinia erat. Vestibulum sed magna at nunc commodo placerat.
370,517,"Jacobson, Davis and Bogan",Pharmacist,2,In quis justo. Maecenas rhoncus aliquam lacus. Morbi quis tortor id nulla ultrices aliquet.
371,933,Schmidt LLC,Environmental Tech,5,"Quisque porta volutpat erat. Quisque erat eros, viverra eget, congue eget, semper rutrum, nulla. Nunc purus."
372,159,King-O'Connell,Statistician III,2,"Morbi non lectus. Aliquam sit amet diam in magna bibendum imperdiet. Nullam orci pede, venenatis non, sodales sed, tincidunt eu, felis."
373,330,Schuster-Wunsch,Quality Control Specialist,3,"Curabitur gravida nisi at nibh. In hac habitasse platea dictumst. Aliquam augue quam, sollicitudin vitae, consectetuer eget, rutrum at, lorem."
374,829,"Russel, Torphy and McDermott",Senior Developer,4,"Maecenas tristique, est et tempus semper, est quam pharetra magna, ac consequat metus sapien ut nunc. Vestibulum ante ipsum primis in faucibus orci luctus et ultrices posuere cubilia Curae; Mauris viverra diam vitae quam. Suspendisse potenti."
375,580,"Gulgowski, Nicolas and Fadel",Associate Professor,3,Aliquam quis turpis eget elit sodales scelerisque. Mauris sit amet eros. Suspendisse accumsan tortor quis turpis.
376,814,Ratke and Sons,Recruiter,1,"Curabitur at ipsum ac tellus semper interdum. Mauris ullamcorper purus sit amet nulla. Quisque arcu libero, rutrum ac, lobortis vel, dapibus at, diam."
377,655,White Inc,Structural Analysis Engineer,6,Etiam vel augue. Vestibulum rutrum rutrum neque. Aenean auctor gravida sem.
378,606,Prohaska LLC,Account Coordinator,2,"Mauris enim leo, rhoncus sed, vestibulum sit amet, cursus id, turpis. Integer aliquet, massa id lobortis convallis, tortor risus dapibus augue, vel accumsan tellus nisi eu orci. Mauris lacinia sapien quis libero."
379,771,Mayert and Sons,Developer II,2,"Quisque porta volutpat erat. Quisque erat eros, viverra eget, congue eget, semper rutrum, nulla. Nunc purus."
380,348,Kertzmann LLC,Staff Accountant II,6,Duis consequat dui nec nisi volutpat eleifend. Donec ut dolor. Morbi vel lectus in quam fringilla rhoncus.
381,519,Skiles and Sons,Software Consultant,3,"Aenean fermentum. Donec ut mauris eget massa tempor convallis. Nulla neque libero, convallis eget, eleifend luctus, ultricies eu, nibh."
382,194,Johnston Inc,Safety Technician I,6,In congue. Etiam justo. Etiam pretium iaculis justo.
383,33,"Swaniawski, Connelly and Kris",Food Chemist,5,"Quisque porta volutpat erat. Quisque erat eros, viverra eget, congue eget, semper rutrum, nulla. Nunc purus."
384,818,"Koch, Hahn and Mraz",Dental Hygienist,5,"Morbi porttitor lorem id ligula. Suspendisse ornare consequat lectus. In est risus, auctor sed, tristique in, tempus sit amet, sem."
385,306,Stehr-Aufderhar,Chief Design Engineer,3,Integer ac leo. Pellentesque ultrices mattis odio. Donec vitae nisi.
386,534,Hessel-Douglas,Account Representative I,3,Sed ante. Vivamus tortor. Duis mattis egestas metus.
387,877,Abshire-Luettgen,Programmer Analyst IV,4,"In sagittis dui vel nisl. Duis ac nibh. Fusce lacus purus, aliquet at, feugiat non, pretium quis, lectus."
388,446,Pfeffer-Skiles,Engineer III,1,"Curabitur in libero ut massa volutpat convallis. Morbi odio odio, elementum eu, interdum eu, tincidunt in, leo. Maecenas pulvinar lobortis est."
389,449,O'Hara-Botsford,Junior Executive,5,Cras non velit nec nisi vulputate nonummy. Maecenas tincidunt lacus at velit. Vivamus vel nulla eget eros elementum pellentesque.
390,565,Turner-Gleason,Help Desk Technician,6,Maecenas ut massa quis augue luctus tincidunt. Nulla mollis molestie lorem. Quisque ut erat.
391,475,Herman-Littel,Structural Analysis Engineer,5,In congue. Etiam justo. Etiam pretium iaculis justo.
392,6,"Krajcik, Swift and Howell",Administrative Assistant II,5,Aliquam quis turpis eget elit sodales scelerisque. Mauris sit amet eros. Suspendisse accumsan tortor quis turpis.
393,561,"Stokes, Abernathy and Greenfelder",Administrative Assistant II,1,"Cras mi pede, malesuada in, imperdiet et, commodo vulputate, justo. In blandit ultrices enim. Lorem ipsum dolor sit amet, consectetuer adipiscing elit."
394,214,O'Reilly-Jacobi,Budget/Accounting Analyst IV,3,Aliquam quis turpis eget elit sodales scelerisque. Mauris sit amet eros. Suspendisse accumsan tortor quis turpis.
395,105,"Kuhn, Pacocha and Turcotte",Web Designer II,6,"Quisque porta volutpat erat. Quisque erat eros, viverra eget, congue eget, semper rutrum, nulla. Nunc purus."
396,640,"Hickle, Nicolas and Predovic",Computer Systems Analyst IV,1,"Aenean fermentum. Donec ut mauris eget massa tempor convallis. Nulla neque libero, convallis eget, eleifend luctus, ultricies eu, nibh."
397,182,Schamberger Group,Senior Financial Analyst,6,"Sed sagittis. Nam congue, risus semper porta volutpat, quam pede lobortis ligula, sit amet eleifend pede libero quis orci. Nullam molestie nibh in lectus."
398,454,"Ratke, Robel and Bergstrom",Recruiter,5,Phasellus sit amet erat. Nulla tempus. Vivamus in felis eu sapien cursus vestibulum.
399,373,Runte-Fisher,Financial Advisor,2,"Praesent blandit. Nam nulla. Integer pede justo, lacinia eget, tincidunt eget, tempus vel, pede."
400,278,"Greenholt, Hammes and Bechtelar",Social Worker,3,Aliquam quis turpis eget elit sodales scelerisque. Mauris sit amet eros. Suspendisse accumsan tortor quis turpis.
401,784,Boyer-Batz,Professor,2,"Proin interdum mauris non ligula pellentesque ultrices. Phasellus id sapien in sapien iaculis congue. Vivamus metus arcu, adipiscing molestie, hendrerit at, vulputate vitae, nisl."
402,710,Lang LLC,Director of Sales,6,Phasellus sit amet erat. Nulla tempus. Vivamus in felis eu sapien cursus vestibulum.
403,701,"Ullrich, Rath and Watsica",Senior Quality Engineer,1,"Maecenas leo odio, condimentum id, luctus nec, molestie sed, justo. Pellentesque viverra pede ac diam. Cras pellentesque volutpat dui."
404,658,King and Sons,Financial Advisor,2,"Vestibulum quam sapien, varius ut, blandit non, interdum in, ante. Vestibulum ante ipsum primis in faucibus orci luctus et ultrices posuere cubilia Curae; Duis faucibus accumsan odio. Curabitur convallis."
405,520,Reilly-Morissette,Financial Analyst,2,"Aenean fermentum. Donec ut mauris eget massa tempor convallis. Nulla neque libero, convallis eget, eleifend luctus, ultricies eu, nibh."
406,83,"Johnston, Homenick and Zulauf",Software Consultant,1,"Aenean fermentum. Donec ut mauris eget massa tempor convallis. Nulla neque libero, convallis eget, eleifend luctus, ultricies eu, nibh."
407,984,Gorczany-Weber,Staff Accountant I,4,Pellentesque at nulla. Suspendisse potenti. Cras in purus eu magna vulputate luctus.
408,487,Rempel-Heidenreich,Chief Design Engineer,4,Sed ante. Vivamus tortor. Duis mattis egestas metus.
409,133,Windler-Schimmel,Desktop Support Technician,6,Phasellus in felis. Donec semper sapien a libero. Nam dui.
410,55,"Jakubowski, Hagenes and Jakubowski",Health Coach IV,4,"Vestibulum ac est lacinia nisi venenatis tristique. Fusce congue, diam id ornare imperdiet, sapien urna pretium nisl, ut volutpat sapien arcu sed augue. Aliquam erat volutpat."
411,835,Flatley-O'Keefe,Pharmacist,4,"Maecenas tristique, est et tempus semper, est quam pharetra magna, ac consequat metus sapien ut nunc. Vestibulum ante ipsum primis in faucibus orci luctus et ultrices posuere cubilia Curae; Mauris viverra diam vitae quam. Suspendisse potenti."
412,960,Kirlin Group,Safety Technician IV,1,"Morbi porttitor lorem id ligula. Suspendisse ornare consequat lectus. In est risus, auctor sed, tristique in, tempus sit amet, sem."
413,120,"Herman, Hauck and Romaguera",Dental Hygienist,2,Duis consequat dui nec nisi volutpat eleifend. Donec ut dolor. Morbi vel lectus in quam fringilla rhoncus.
414,572,"Moore, Breitenberg and Hilll",Executive Secretary,1,"Fusce posuere felis sed lacus. Morbi sem mauris, laoreet ut, rhoncus aliquet, pulvinar sed, nisl. Nunc rhoncus dui vel sem."
415,991,Ledner Inc,Librarian,1,Etiam vel augue. Vestibulum rutrum rutrum neque. Aenean auctor gravida sem.
416,393,Kutch Group,Software Consultant,2,"Morbi non lectus. Aliquam sit amet diam in magna bibendum imperdiet. Nullam orci pede, venenatis non, sodales sed, tincidunt eu, felis."
417,519,Bernier-Nolan,Speech Pathologist,6,Sed ante. Vivamus tortor. Duis mattis egestas metus.
418,552,Ullrich-Hammes,Web Designer II,4,"Maecenas tristique, est et tempus semper, est quam pharetra magna, ac consequat metus sapien ut nunc. Vestibulum ante ipsum primis in faucibus orci luctus et ultrices posuere cubilia Curae; Mauris viverra diam vitae quam. Suspendisse potenti."
419,79,Kuvalis-Bartell,Senior Cost Accountant,5,Fusce consequat. Nulla nisl. Nunc nisl.
420,832,Cormier Group,Analog Circuit Design manager,4,"Praesent blandit. Nam nulla. Integer pede justo, lacinia eget, tincidunt eget, tempus vel, pede."
421,411,Predovic-Muller,Web Designer IV,1,Praesent id massa id nisl venenatis lacinia. Aenean sit amet justo. Morbi ut odio.
422,309,Veum-Hand,Structural Analysis Engineer,4,Duis consequat dui nec nisi volutpat eleifend. Donec ut dolor. Morbi vel lectus in quam fringilla rhoncus.
423,93,Kovacek and Sons,Nurse,3,Aenean lectus. Pellentesque eget nunc. Donec quis orci eget orci vehicula condimentum.
424,297,Friesen-Schulist,Civil Engineer,1,"Duis bibendum, felis sed interdum venenatis, turpis enim blandit mi, in porttitor pede justo eu massa. Donec dapibus. Duis at velit eu est congue elementum."
425,348,Feeney and Sons,Software Consultant,5,Nulla ut erat id mauris vulputate elementum. Nullam varius. Nulla facilisi.
426,669,"Orn, Stamm and Kilback",Software Engineer III,1,"In hac habitasse platea dictumst. Morbi vestibulum, velit id pretium iaculis, diam erat fermentum justo, nec condimentum neque sapien placerat ante. Nulla justo."
427,72,"Grady, Jakubowski and Dare",VP Quality Control,2,"Morbi non lectus. Aliquam sit amet diam in magna bibendum imperdiet. Nullam orci pede, venenatis non, sodales sed, tincidunt eu, felis."
428,24,"Little, Huel and Windler",Automation Specialist I,1,Nullam porttitor lacus at turpis. Donec posuere metus vitae ipsum. Aliquam non mauris.
429,226,Johnson-Hintz,VP Sales,4,"Curabitur at ipsum ac tellus semper interdum. Mauris ullamcorper purus sit amet nulla. Quisque arcu libero, rutrum ac, lobortis vel, dapibus at, diam."
430,43,"Schumm, Torp and Balistreri",VP Sales,6,"Mauris enim leo, rhoncus sed, vestibulum sit amet, cursus id, turpis. Integer aliquet, massa id lobortis convallis, tortor risus dapibus augue, vel accumsan tellus nisi eu orci. Mauris lacinia sapien quis libero."
431,363,Bauch-Windler,Automation Specialist II,4,Nulla ut erat id mauris vulputate elementum. Nullam varius. Nulla facilisi.
432,652,Trantow-Erdman,Speech Pathologist,5,"Vestibulum ac est lacinia nisi venenatis tristique. Fusce congue, diam id ornare imperdiet, sapien urna pretium nisl, ut volutpat sapien arcu sed augue. Aliquam erat volutpat."
433,738,"Schmitt, Koelpin and Boyer",Junior Executive,6,Integer tincidunt ante vel ipsum. Praesent blandit lacinia erat. Vestibulum sed magna at nunc commodo placerat.
434,570,Hills LLC,Cost Accountant,2,Nullam porttitor lacus at turpis. Donec posuere metus vitae ipsum. Aliquam non mauris.
435,305,Gleason-Bernier,Cost Accountant,1,"Donec diam neque, vestibulum eget, vulputate ut, ultrices vel, augue. Vestibulum ante ipsum primis in faucibus orci luctus et ultrices posuere cubilia Curae; Donec pharetra, magna vestibulum aliquet ultrices, erat tortor sollicitudin mi, sit amet lobortis sapien sapien non mi. Integer ac neque."
436,972,O'Keefe-Borer,Safety Technician II,4,"Curabitur gravida nisi at nibh. In hac habitasse platea dictumst. Aliquam augue quam, sollicitudin vitae, consectetuer eget, rutrum at, lorem."
437,902,"Vandervort, Kautzer and Armstrong",Geological Engineer,4,In hac habitasse platea dictumst. Etiam faucibus cursus urna. Ut tellus.
438,511,Murphy-Kassulke,VP Marketing,3,"In sagittis dui vel nisl. Duis ac nibh. Fusce lacus purus, aliquet at, feugiat non, pretium quis, lectus."
439,62,"Zboncak, Mayert and Beatty",Assistant Manager,4,Suspendisse potenti. In eleifend quam a odio. In hac habitasse platea dictumst.
440,489,Leuschke-Greenfelder,Community Outreach Specialist,3,"Nam ultrices, libero non mattis pulvinar, nulla pede ullamcorper augue, a suscipit nulla elit ac nulla. Sed vel enim sit amet nunc viverra dapibus. Nulla suscipit ligula in lacus."
441,467,Hoeger Inc,Media Manager IV,6,"Cras mi pede, malesuada in, imperdiet et, commodo vulputate, justo. In blandit ultrices enim. Lorem ipsum dolor sit amet, consectetuer adipiscing elit."
442,429,Trantow Inc,Chemical Engineer,3,Integer ac leo. Pellentesque ultrices mattis odio. Donec vitae nisi.
443,428,Moore-Reichert,Nurse Practicioner,1,"Aenean fermentum. Donec ut mauris eget massa tempor convallis. Nulla neque libero, convallis eget, eleifend luctus, ultricies eu, nibh."
444,893,"Lang, Grimes and Boehm",Administrative Assistant I,2,"Fusce posuere felis sed lacus. Morbi sem mauris, laoreet ut, rhoncus aliquet, pulvinar sed, nisl. Nunc rhoncus dui vel sem."
445,312,Pollich-Kerluke,Database Administrator II,2,Aenean lectus. Pellentesque eget nunc. Donec quis orci eget orci vehicula condimentum.
446,778,Schiller Group,Geological Engineer,5,"Vestibulum quam sapien, varius ut, blandit non, interdum in, ante. Vestibulum ante ipsum primis in faucibus orci luctus et ultrices posuere cubilia Curae; Duis faucibus accumsan odio. Curabitur convallis."
447,10,"Kovacek, Lehner and Daniel",Sales Representative,2,In hac habitasse platea dictumst. Etiam faucibus cursus urna. Ut tellus.
448,619,"Schuppe, Fahey and Jakubowski",Research Assistant IV,4,"Morbi porttitor lorem id ligula. Suspendisse ornare consequat lectus. In est risus, auctor sed, tristique in, tempus sit amet, sem."
449,890,Farrell-Ullrich,Sales Representative,5,"Mauris enim leo, rhoncus sed, vestibulum sit amet, cursus id, turpis. Integer aliquet, massa id lobortis convallis, tortor risus dapibus augue, vel accumsan tellus nisi eu orci. Mauris lacinia sapien quis libero."
450,186,"Lueilwitz, Mitchell and Kilback",Pharmacist,1,Duis aliquam convallis nunc. Proin at turpis a pede posuere nonummy. Integer non velit.
451,800,Gottlieb-Schmeler,Paralegal,4,"Sed sagittis. Nam congue, risus semper porta volutpat, quam pede lobortis ligula, sit amet eleifend pede libero quis orci. Nullam molestie nibh in lectus."
452,801,Jacobi-Donnelly,Account Executive,3,"Morbi non lectus. Aliquam sit amet diam in magna bibendum imperdiet. Nullam orci pede, venenatis non, sodales sed, tincidunt eu, felis."
453,944,"Rosenbaum, Champlin and Legros",Quality Control Specialist,2,"Praesent blandit. Nam nulla. Integer pede justo, lacinia eget, tincidunt eget, tempus vel, pede."
