ActivityID,JobSeekerID,OrganizationName,EAJobRole,EATimeRange,EADescription
595,237,"Sawayn, Altenwerth and Wyman",Software Consultant,2,"Maecenas tristique, est et tempus semper, est quam pharetra magna, ac consequat metus sapien ut nunc. Vestibulum ante ipsum primis in faucibus orci luctus et ultrices posuere cubilia Curae; Mauris viverra diam vitae quam. Suspendisse potenti."
596,339,Runte Inc,Health Coach III,4,Nulla ut erat id mauris vulputate elementum. Nullam varius. Nulla facilisi.
597,180,Osinski-Pfeffer,Cost Accountant,6,"Morbi porttitor lorem id ligula. Suspendisse ornare consequat lectus. In est risus, auctor sed, tristique in, tempus sit amet, sem."
598,245,"Leffler, Schuster and Gulgowski",Financial Advisor,2,Phasellus sit amet erat. Nulla tempus. Vivamus in felis eu sapien cursus vestibulum.
599,210,Spinka-Treutel,Human Resources Manager,6,Nullam sit amet turpis elementum ligula vehicula consequat. Morbi a ipsum. Integer a nibh.
600,527,"Gislason, Rogahn and Bins",Account Executive,5,"Mauris enim leo, rhoncus sed, vestibulum sit amet, cursus id, turpis. Integer aliquet, massa id lobortis convallis, tortor risus dapibus augue, vel accumsan tellus nisi eu orci. Mauris lacinia sapien quis libero."
601,440,Reynolds Inc,Junior Executive,2,Aliquam quis turpis eget elit sodales scelerisque. Mauris sit amet eros. Suspendisse accumsan tortor quis turpis.
602,162,Strosin Inc,Analog Circuit Design manager,4,"Mauris enim leo, rhoncus sed, vestibulum sit amet, cursus id, turpis. Integer aliquet, massa id lobortis convallis, tortor risus dapibus augue, vel accumsan tellus nisi eu orci. Mauris lacinia sapien quis libero."
603,804,"Jacobi, Wyman and Stiedemann",Human Resources Manager,6,"Curabitur at ipsum ac tellus semper interdum. Mauris ullamcorper purus sit amet nulla. Quisque arcu libero, rutrum ac, lobortis vel, dapibus at, diam."
604,923,Cummerata Group,Project Manager,2,"Cum sociis natoque penatibus et magnis dis parturient montes, nascetur ridiculus mus. Vivamus vestibulum sagittis sapien. Cum sociis natoque penatibus et magnis dis parturient montes, nascetur ridiculus mus."
605,743,Marks-Upton,Sales Associate,4,"Morbi non lectus. Aliquam sit amet diam in magna bibendum imperdiet. Nullam orci pede, venenatis non, sodales sed, tincidunt eu, felis."
606,985,"Spencer, Sanford and Gulgowski",Social Worker,3,Maecenas ut massa quis augue luctus tincidunt. Nulla mollis molestie lorem. Quisque ut erat.
607,622,Swaniawski LLC,Physical Therapy Assistant,2,Fusce consequat. Nulla nisl. Nunc nisl.
608,14,Thiel-Mayer,Chief Design Engineer,4,Pellentesque at nulla. Suspendisse potenti. Cras in purus eu magna vulputate luctus.
609,686,Wisozk Inc,Programmer Analyst II,1,Aliquam quis turpis eget elit sodales scelerisque. Mauris sit amet eros. Suspendisse accumsan tortor quis turpis.
610,999,Heidenreich LLC,Account Executive,3,"Proin eu mi. Nulla ac enim. In tempor, turpis nec euismod scelerisque, quam turpis adipiscing lorem, vitae mattis nibh ligula nec sem."
611,648,"Berge, Bayer and Flatley",Environmental Specialist,5,"Vestibulum ac est lacinia nisi venenatis tristique. Fusce congue, diam id ornare imperdiet, sapien urna pretium nisl, ut volutpat sapien arcu sed augue. Aliquam erat volutpat."
612,913,Luettgen-Wiegand,Geologist IV,4,Nullam sit amet turpis elementum ligula vehicula consequat. Morbi a ipsum. Integer a nibh.
613,543,"Williamson, Haley and Oberbrunner",Senior Editor,3,Praesent id massa id nisl venenatis lacinia. Aenean sit amet justo. Morbi ut odio.
614,787,Greenholt Group,Executive Secretary,6,"Morbi porttitor lorem id ligula. Suspendisse ornare consequat lectus. In est risus, auctor sed, tristique in, tempus sit amet, sem."
615,666,"Ryan, Kuvalis and Koepp",Nuclear Power Engineer,4,"Aenean fermentum. Donec ut mauris eget massa tempor convallis. Nulla neque libero, convallis eget, eleifend luctus, ultricies eu, nibh."
616,387,"Hills, Dickens and Becker",VP Product Management,6,"Sed sagittis. Nam congue, risus semper porta volutpat, quam pede lobortis ligula, sit amet eleifend pede libero quis orci. Nullam molestie nibh in lectus."
617,585,"Schmeler, Wyman and Will",Assistant Manager,1,Phasellus in felis. Donec semper sapien a libero. Nam dui.
618,380,"Christiansen, Harris and Kozey",Legal Assistant,6,"Cum sociis natoque penatibus et magnis dis parturient montes, nascetur ridiculus mus. Vivamus vestibulum sagittis sapien. Cum sociis natoque penatibus et magnis dis parturient montes, nascetur ridiculus mus."
619,212,Boehm Inc,Senior Editor,6,"Lorem ipsum dolor sit amet, consectetuer adipiscing elit. Proin risus. Praesent lectus."
620,466,Funk LLC,Recruiting Manager,4,In hac habitasse platea dictumst. Etiam faucibus cursus urna. Ut tellus.
621,120,"Keebler, Streich and Barton",Mechanical Systems Engineer,3,Nullam porttitor lacus at turpis. Donec posuere metus vitae ipsum. Aliquam non mauris.
622,799,Schmeler-Hayes,Registered Nurse,2,"Aenean fermentum. Donec ut mauris eget massa tempor convallis. Nulla neque libero, convallis eget, eleifend luctus, ultricies eu, nibh."
623,828,Goldner-Dooley,Product Engineer,1,"Curabitur gravida nisi at nibh. In hac habitasse platea dictumst. Aliquam augue quam, sollicitudin vitae, consectetuer eget, rutrum at, lorem."
624,847,"Williamson, Feil and Schmitt",Analog Circuit Design manager,5,"In hac habitasse platea dictumst. Morbi vestibulum, velit id pretium iaculis, diam erat fermentum justo, nec condimentum neque sapien placerat ante. Nulla justo."
625,222,Schmeler Group,Social Worker,6,Etiam vel augue. Vestibulum rutrum rutrum neque. Aenean auctor gravida sem.
626,853,"Windler, Sauer and Jacobi",Compensation Analyst,4,Phasellus in felis. Donec semper sapien a libero. Nam dui.
627,929,"Ondricka, Erdman and Lind",Biostatistician I,5,"Morbi porttitor lorem id ligula. Suspendisse ornare consequat lectus. In est risus, auctor sed, tristique in, tempus sit amet, sem."
628,516,"Littel, Reichel and Romaguera",Product Engineer,5,"Fusce posuere felis sed lacus. Morbi sem mauris, laoreet ut, rhoncus aliquet, pulvinar sed, nisl. Nunc rhoncus dui vel sem."
629,766,"McLaughlin, Kuhn and Larkin",Editor,1,Integer ac leo. Pellentesque ultrices mattis odio. Donec vitae nisi.
630,962,Prosacco-Dickens,Operator,2,"In sagittis dui vel nisl. Duis ac nibh. Fusce lacus purus, aliquet at, feugiat non, pretium quis, lectus."
631,195,Baumbach-Rosenbaum,Senior Quality Engineer,4,In congue. Etiam justo. Etiam pretium iaculis justo.
632,143,Mitchell-Aufderhar,Software Consultant,6,Integer ac leo. Pellentesque ultrices mattis odio. Donec vitae nisi.
633,133,Collins LLC,VP Product Management,6,In hac habitasse platea dictumst. Etiam faucibus cursus urna. Ut tellus.
634,381,"Graham, Okuneva and Douglas",Software Consultant,5,"Vestibulum quam sapien, varius ut, blandit non, interdum in, ante. Vestibulum ante ipsum primis in faucibus orci luctus et ultrices posuere cubilia Curae; Duis faucibus accumsan odio. Curabitur convallis."
635,38,"Hackett, Hane and Ferry",Programmer III,6,"Fusce posuere felis sed lacus. Morbi sem mauris, laoreet ut, rhoncus aliquet, pulvinar sed, nisl. Nunc rhoncus dui vel sem."
636,2,"Morar, Leannon and Kunze",Web Designer II,1,Etiam vel augue. Vestibulum rutrum rutrum neque. Aenean auctor gravida sem.
637,599,Sanford-Zboncak,Paralegal,1,"Cum sociis natoque penatibus et magnis dis parturient montes, nascetur ridiculus mus. Vivamus vestibulum sagittis sapien. Cum sociis natoque penatibus et magnis dis parturient montes, nascetur ridiculus mus."
638,62,"McClure, Willms and Bauch",Senior Financial Analyst,5,Aliquam quis turpis eget elit sodales scelerisque. Mauris sit amet eros. Suspendisse accumsan tortor quis turpis.
639,344,"Rolfson, Will and Feeney",Nurse,2,Nullam sit amet turpis elementum ligula vehicula consequat. Morbi a ipsum. Integer a nibh.
640,770,Hessel-Rohan,Librarian,4,Phasellus sit amet erat. Nulla tempus. Vivamus in felis eu sapien cursus vestibulum.
641,633,"Robel, Rolfson and Tillman",Data Coordinator,5,"Cum sociis natoque penatibus et magnis dis parturient montes, nascetur ridiculus mus. Vivamus vestibulum sagittis sapien. Cum sociis natoque penatibus et magnis dis parturient montes, nascetur ridiculus mus."
642,28,Kuvalis and Sons,Teacher,5,"Curabitur at ipsum ac tellus semper interdum. Mauris ullamcorper purus sit amet nulla. Quisque arcu libero, rutrum ac, lobortis vel, dapibus at, diam."
643,917,Lesch and Sons,Automation Specialist II,4,Fusce consequat. Nulla nisl. Nunc nisl.
644,935,"Mann, Koss and Frami",Database Administrator I,6,"Donec diam neque, vestibulum eget, vulputate ut, ultrices vel, augue. Vestibulum ante ipsum primis in faucibus orci luctus et ultrices posuere cubilia Curae; Donec pharetra, magna vestibulum aliquet ultrices, erat tortor sollicitudin mi, sit amet lobortis sapien sapien non mi. Integer ac neque."
645,518,Rosenbaum-Steuber,Sales Associate,2,"Curabitur in libero ut massa volutpat convallis. Morbi odio odio, elementum eu, interdum eu, tincidunt in, leo. Maecenas pulvinar lobortis est."
646,671,Hessel-Kuhlman,Analyst Programmer,4,Suspendisse potenti. In eleifend quam a odio. In hac habitasse platea dictumst.
647,553,Ortiz LLC,VP Marketing,5,Nulla ut erat id mauris vulputate elementum. Nullam varius. Nulla facilisi.
648,470,Bauch Group,Registered Nurse,4,Nullam porttitor lacus at turpis. Donec posuere metus vitae ipsum. Aliquam non mauris.
649,758,Johns Group,Biostatistician IV,1,Aenean lectus. Pellentesque eget nunc. Donec quis orci eget orci vehicula condimentum.
650,234,Krajcik LLC,VP Quality Control,1,Sed ante. Vivamus tortor. Duis mattis egestas metus.
651,426,Daniel-Lang,Dental Hygienist,3,"Cum sociis natoque penatibus et magnis dis parturient montes, nascetur ridiculus mus. Vivamus vestibulum sagittis sapien. Cum sociis natoque penatibus et magnis dis parturient montes, nascetur ridiculus mus."
652,777,Leuschke-Altenwerth,Safety Technician III,3,Praesent id massa id nisl venenatis lacinia. Aenean sit amet justo. Morbi ut odio.
653,773,Mann Inc,Research Nurse,2,Integer tincidunt ante vel ipsum. Praesent blandit lacinia erat. Vestibulum sed magna at nunc commodo placerat.
654,390,"Cummings, Beier and Bergstrom",Tax Accountant,3,"In sagittis dui vel nisl. Duis ac nibh. Fusce lacus purus, aliquet at, feugiat non, pretium quis, lectus."
655,213,"Emard, Cronin and Watsica",Tax Accountant,6,"Fusce posuere felis sed lacus. Morbi sem mauris, laoreet ut, rhoncus aliquet, pulvinar sed, nisl. Nunc rhoncus dui vel sem."
656,388,Bradtke-Erdman,Graphic Designer,4,"Duis bibendum, felis sed interdum venenatis, turpis enim blandit mi, in porttitor pede justo eu massa. Donec dapibus. Duis at velit eu est congue elementum."
657,932,"Schamberger, Kirlin and Howell",Legal Assistant,1,"Proin interdum mauris non ligula pellentesque ultrices. Phasellus id sapien in sapien iaculis congue. Vivamus metus arcu, adipiscing molestie, hendrerit at, vulputate vitae, nisl."
658,722,"Gottlieb, West and Wisoky",Senior Sales Associate,3,Nulla ut erat id mauris vulputate elementum. Nullam varius. Nulla facilisi.
659,307,Hammes-Weimann,Senior Cost Accountant,2,Nullam porttitor lacus at turpis. Donec posuere metus vitae ipsum. Aliquam non mauris.
660,768,Leffler Group,General Manager,4,"Mauris enim leo, rhoncus sed, vestibulum sit amet, cursus id, turpis. Integer aliquet, massa id lobortis convallis, tortor risus dapibus augue, vel accumsan tellus nisi eu orci. Mauris lacinia sapien quis libero."
661,858,Simonis Inc,Structural Engineer,6,"Duis bibendum, felis sed interdum venenatis, turpis enim blandit mi, in porttitor pede justo eu massa. Donec dapibus. Duis at velit eu est congue elementum."
662,360,Schoen Inc,Business Systems Development Analyst,1,Integer ac leo. Pellentesque ultrices mattis odio. Donec vitae nisi.
663,386,Wehner Inc,Associate Professor,1,Phasellus sit amet erat. Nulla tempus. Vivamus in felis eu sapien cursus vestibulum.
664,65,Langosh-Rohan,Human Resources Assistant IV,3,Duis bibendum. Morbi non quam nec dui luctus rutrum. Nulla tellus.
665,735,"Herman, Dare and Donnelly",Junior Executive,1,"Aenean fermentum. Donec ut mauris eget massa tempor convallis. Nulla neque libero, convallis eget, eleifend luctus, ultricies eu, nibh."
666,971,"Wiza, Kuhic and Boyer",Nuclear Power Engineer,4,Duis bibendum. Morbi non quam nec dui luctus rutrum. Nulla tellus.
667,745,DuBuque and Sons,Community Outreach Specialist,3,In hac habitasse platea dictumst. Etiam faucibus cursus urna. Ut tellus.
668,579,"Yost, Flatley and Schmidt",Structural Engineer,3,"Morbi porttitor lorem id ligula. Suspendisse ornare consequat lectus. In est risus, auctor sed, tristique in, tempus sit amet, sem."
669,372,Lindgren and Sons,Geologist IV,1,Nullam porttitor lacus at turpis. Donec posuere metus vitae ipsum. Aliquam non mauris.
670,85,"Keebler, Collier and Dach",Human Resources Assistant III,2,Nullam sit amet turpis elementum ligula vehicula consequat. Morbi a ipsum. Integer a nibh.
671,162,Harber Group,Clinical Specialist,1,In congue. Etiam justo. Etiam pretium iaculis justo.
672,1000,"Kassulke, Fadel and Fisher",Office Assistant IV,3,Pellentesque at nulla. Suspendisse potenti. Cras in purus eu magna vulputate luctus.
673,636,Beier-Hilpert,Health Coach III,6,Duis bibendum. Morbi non quam nec dui luctus rutrum. Nulla tellus.
674,67,Reinger-Mayer,Software Engineer II,1,"Proin eu mi. Nulla ac enim. In tempor, turpis nec euismod scelerisque, quam turpis adipiscing lorem, vitae mattis nibh ligula nec sem."
675,809,Dooley-Kub,Sales Representative,6,"Cras mi pede, malesuada in, imperdiet et, commodo vulputate, justo. In blandit ultrices enim. Lorem ipsum dolor sit amet, consectetuer adipiscing elit."
676,568,Ziemann LLC,Chief Design Engineer,2,Aenean lectus. Pellentesque eget nunc. Donec quis orci eget orci vehicula condimentum.
677,270,Howe Group,Technical Writer,3,"Duis bibendum, felis sed interdum venenatis, turpis enim blandit mi, in porttitor pede justo eu massa. Donec dapibus. Duis at velit eu est congue elementum."
678,89,"Powlowski, Braun and Torp",Administrative Assistant IV,5,"Fusce posuere felis sed lacus. Morbi sem mauris, laoreet ut, rhoncus aliquet, pulvinar sed, nisl. Nunc rhoncus dui vel sem."
679,382,Waelchi-Hartmann,Administrative Assistant II,2,Praesent id massa id nisl venenatis lacinia. Aenean sit amet justo. Morbi ut odio.
680,937,Carter-Zboncak,Account Coordinator,6,Duis aliquam convallis nunc. Proin at turpis a pede posuere nonummy. Integer non velit.
681,66,"Braun, Kuhic and Stanton",Environmental Specialist,1,"Proin eu mi. Nulla ac enim. In tempor, turpis nec euismod scelerisque, quam turpis adipiscing lorem, vitae mattis nibh ligula nec sem."
682,131,Jenkins-Bruen,Mechanical Systems Engineer,6,Maecenas ut massa quis augue luctus tincidunt. Nulla mollis molestie lorem. Quisque ut erat.
683,427,"Willms, Jacobi and Wuckert",Software Test Engineer II,6,"Morbi porttitor lorem id ligula. Suspendisse ornare consequat lectus. In est risus, auctor sed, tristique in, tempus sit amet, sem."
684,438,Murazik-Littel,Actuary,1,Nullam sit amet turpis elementum ligula vehicula consequat. Morbi a ipsum. Integer a nibh.
685,299,Nitzsche-Torphy,Accounting Assistant III,2,"Proin eu mi. Nulla ac enim. In tempor, turpis nec euismod scelerisque, quam turpis adipiscing lorem, vitae mattis nibh ligula nec sem."
686,752,"Goyette, Upton and Lebsack",Recruiting Manager,5,Nullam sit amet turpis elementum ligula vehicula consequat. Morbi a ipsum. Integer a nibh.
687,756,Hirthe-Cronin,Clinical Specialist,4,"Vestibulum ac est lacinia nisi venenatis tristique. Fusce congue, diam id ornare imperdiet, sapien urna pretium nisl, ut volutpat sapien arcu sed augue. Aliquam erat volutpat."
688,362,Jacobs-Gottlieb,Safety Technician II,2,Praesent id massa id nisl venenatis lacinia. Aenean sit amet justo. Morbi ut odio.
689,157,Jerde-Grimes,Nurse Practicioner,6,Sed ante. Vivamus tortor. Duis mattis egestas metus.
690,682,Metz Inc,Speech Pathologist,2,Phasellus in felis. Donec semper sapien a libero. Nam dui.
691,602,"Brekke, Kiehn and Hills",Senior Developer,6,"Vestibulum quam sapien, varius ut, blandit non, interdum in, ante. Vestibulum ante ipsum primis in faucibus orci luctus et ultrices posuere cubilia Curae; Duis faucibus accumsan odio. Curabitur convallis."
692,510,Schaefer and Sons,Sales Associate,3,In congue. Etiam justo. Etiam pretium iaculis justo.
693,562,Rodriguez-Anderson,Chief Design Engineer,4,In hac habitasse platea dictumst. Etiam faucibus cursus urna. Ut tellus.
694,920,Ledner-Hayes,Recruiting Manager,3,"Quisque porta volutpat erat. Quisque erat eros, viverra eget, congue eget, semper rutrum, nulla. Nunc purus."
695,498,"Bogisich, O'Conner and Cruickshank",Mechanical Systems Engineer,2,"Donec diam neque, vestibulum eget, vulputate ut, ultrices vel, augue. Vestibulum ante ipsum primis in faucibus orci luctus et ultrices posuere cubilia Curae; Donec pharetra, magna vestibulum aliquet ultrices, erat tortor sollicitudin mi, sit amet lobortis sapien sapien non mi. Integer ac neque."
696,672,Macejkovic-Boyle,Dental Hygienist,5,"Proin leo odio, porttitor id, consequat in, consequat ut, nulla. Sed accumsan felis. Ut at dolor quis odio consequat varius."
697,490,Kshlerin-Lebsack,Clinical Specialist,6,Nulla ut erat id mauris vulputate elementum. Nullam varius. Nulla facilisi.
698,411,"Krajcik, Rath and Auer",Quality Engineer,2,Duis aliquam convallis nunc. Proin at turpis a pede posuere nonummy. Integer non velit.
699,855,Anderson-Jast,Legal Assistant,3,Fusce consequat. Nulla nisl. Nunc nisl.
700,87,Ebert-Lubowitz,Web Designer II,3,"In sagittis dui vel nisl. Duis ac nibh. Fusce lacus purus, aliquet at, feugiat non, pretium quis, lectus."
701,102,Lindgren and Sons,Analog Circuit Design manager,4,"Mauris enim leo, rhoncus sed, vestibulum sit amet, cursus id, turpis. Integer aliquet, massa id lobortis convallis, tortor risus dapibus augue, vel accumsan tellus nisi eu orci. Mauris lacinia sapien quis libero."
702,334,Beatty Group,Assistant Media Planner,4,"Curabitur gravida nisi at nibh. In hac habitasse platea dictumst. Aliquam augue quam, sollicitudin vitae, consectetuer eget, rutrum at, lorem."
703,164,Sauer Group,Occupational Therapist,2,"Nam ultrices, libero non mattis pulvinar, nulla pede ullamcorper augue, a suscipit nulla elit ac nulla. Sed vel enim sit amet nunc viverra dapibus. Nulla suscipit ligula in lacus."
704,649,"Franecki, Hills and Lang",Engineer IV,5,"Vestibulum quam sapien, varius ut, blandit non, interdum in, ante. Vestibulum ante ipsum primis in faucibus orci luctus et ultrices posuere cubilia Curae; Duis faucibus accumsan odio. Curabitur convallis."
705,846,"Parisian, Ward and O'Kon",Data Coordinator,3,"Fusce posuere felis sed lacus. Morbi sem mauris, laoreet ut, rhoncus aliquet, pulvinar sed, nisl. Nunc rhoncus dui vel sem."
706,154,Howe-Ward,Dental Hygienist,4,Suspendisse potenti. In eleifend quam a odio. In hac habitasse platea dictumst.
707,842,Wisoky-Murray,Media Manager III,5,In quis justo. Maecenas rhoncus aliquam lacus. Morbi quis tortor id nulla ultrices aliquet.
708,361,Lynch LLC,Health Coach III,3,Sed ante. Vivamus tortor. Duis mattis egestas metus.
709,774,Harvey-Waters,Staff Accountant III,1,Nulla ut erat id mauris vulputate elementum. Nullam varius. Nulla facilisi.
710,400,Cartwright-Murazik,Environmental Specialist,1,"Donec diam neque, vestibulum eget, vulputate ut, ultrices vel, augue. Vestibulum ante ipsum primis in faucibus orci luctus et ultrices posuere cubilia Curae; Donec pharetra, magna vestibulum aliquet ultrices, erat tortor sollicitudin mi, sit amet lobortis sapien sapien non mi. Integer ac neque."
711,495,Will Inc,Information Systems Manager,6,Duis aliquam convallis nunc. Proin at turpis a pede posuere nonummy. Integer non velit.
712,261,Feil-Rice,Programmer Analyst II,3,Maecenas ut massa quis augue luctus tincidunt. Nulla mollis molestie lorem. Quisque ut erat.
713,688,Carroll-Okuneva,Staff Scientist,6,Cras non velit nec nisi vulputate nonummy. Maecenas tincidunt lacus at velit. Vivamus vel nulla eget eros elementum pellentesque.
714,8,Mills LLC,Assistant Media Planner,1,"Proin leo odio, porttitor id, consequat in, consequat ut, nulla. Sed accumsan felis. Ut at dolor quis odio consequat varius."
715,334,Bode-Schmeler,VP Sales,2,Phasellus in felis. Donec semper sapien a libero. Nam dui.
716,986,Boyle-Wolf,Director of Sales,6,"Proin leo odio, porttitor id, consequat in, consequat ut, nulla. Sed accumsan felis. Ut at dolor quis odio consequat varius."
717,675,"Konopelski, Doyle and Gutkowski",Chief Design Engineer,2,Phasellus in felis. Donec semper sapien a libero. Nam dui.
718,249,Auer LLC,Marketing Assistant,4,Phasellus sit amet erat. Nulla tempus. Vivamus in felis eu sapien cursus vestibulum.
719,706,Hickle LLC,Marketing Assistant,3,"Fusce posuere felis sed lacus. Morbi sem mauris, laoreet ut, rhoncus aliquet, pulvinar sed, nisl. Nunc rhoncus dui vel sem."
720,501,Stehr-Walter,Electrical Engineer,6,"Donec diam neque, vestibulum eget, vulputate ut, ultrices vel, augue. Vestibulum ante ipsum primis in faucibus orci luctus et ultrices posuere cubilia Curae; Donec pharetra, magna vestibulum aliquet ultrices, erat tortor sollicitudin mi, sit amet lobortis sapien sapien non mi. Integer ac neque."
721,824,Jast Group,Marketing Assistant,4,Pellentesque at nulla. Suspendisse potenti. Cras in purus eu magna vulputate luctus.
722,130,"Ratke, Bergnaum and Leuschke",Accountant III,6,Praesent id massa id nisl venenatis lacinia. Aenean sit amet justo. Morbi ut odio.
723,804,Mills LLC,Registered Nurse,4,Nullam sit amet turpis elementum ligula vehicula consequat. Morbi a ipsum. Integer a nibh.
724,607,"Murray, Stiedemann and McKenzie",Account Coordinator,6,Integer tincidunt ante vel ipsum. Praesent blandit lacinia erat. Vestibulum sed magna at nunc commodo placerat.
725,564,McLaughlin-Lindgren,GIS Technical Architect,4,Etiam vel augue. Vestibulum rutrum rutrum neque. Aenean auctor gravida sem.
726,582,Walker-Spencer,Teacher,1,"Curabitur at ipsum ac tellus semper interdum. Mauris ullamcorper purus sit amet nulla. Quisque arcu libero, rutrum ac, lobortis vel, dapibus at, diam."
727,294,Schmidt and Sons,Statistician II,3,"Lorem ipsum dolor sit amet, consectetuer adipiscing elit. Proin risus. Praesent lectus."
728,513,"Cruickshank, Wisozk and Funk",Business Systems Development Analyst,2,"Mauris enim leo, rhoncus sed, vestibulum sit amet, cursus id, turpis. Integer aliquet, massa id lobortis convallis, tortor risus dapibus augue, vel accumsan tellus nisi eu orci. Mauris lacinia sapien quis libero."
729,937,"Russel, Berge and Treutel",Database Administrator II,4,"Fusce posuere felis sed lacus. Morbi sem mauris, laoreet ut, rhoncus aliquet, pulvinar sed, nisl. Nunc rhoncus dui vel sem."
730,470,Langosh and Sons,Research Nurse,5,"Quisque id justo sit amet sapien dignissim vestibulum. Vestibulum ante ipsum primis in faucibus orci luctus et ultrices posuere cubilia Curae; Nulla dapibus dolor vel est. Donec odio justo, sollicitudin ut, suscipit a, feugiat et, eros."
731,78,Cassin-Skiles,Food Chemist,2,"Proin leo odio, porttitor id, consequat in, consequat ut, nulla. Sed accumsan felis. Ut at dolor quis odio consequat varius."
732,778,Johns LLC,Dental Hygienist,6,Nullam porttitor lacus at turpis. Donec posuere metus vitae ipsum. Aliquam non mauris.
733,746,Casper and Sons,Senior Financial Analyst,4,"Mauris enim leo, rhoncus sed, vestibulum sit amet, cursus id, turpis. Integer aliquet, massa id lobortis convallis, tortor risus dapibus augue, vel accumsan tellus nisi eu orci. Mauris lacinia sapien quis libero."
734,860,Huels Inc,Design Engineer,5,"Morbi non lectus. Aliquam sit amet diam in magna bibendum imperdiet. Nullam orci pede, venenatis non, sodales sed, tincidunt eu, felis."
735,152,"Stracke, Corkery and Collins",Financial Advisor,5,In quis justo. Maecenas rhoncus aliquam lacus. Morbi quis tortor id nulla ultrices aliquet.
736,476,"Hilll, Hintz and Herzog",Actuary,1,"Praesent blandit. Nam nulla. Integer pede justo, lacinia eget, tincidunt eget, tempus vel, pede."
737,382,Batz Inc,Food Chemist,6,"Duis bibendum, felis sed interdum venenatis, turpis enim blandit mi, in porttitor pede justo eu massa. Donec dapibus. Duis at velit eu est congue elementum."
738,441,Jast-Huel,Staff Accountant I,6,Integer tincidunt ante vel ipsum. Praesent blandit lacinia erat. Vestibulum sed magna at nunc commodo placerat.
739,209,Bartoletti Inc,Data Coordinator,6,Aliquam quis turpis eget elit sodales scelerisque. Mauris sit amet eros. Suspendisse accumsan tortor quis turpis.
740,182,Ward Inc,Administrative Officer,3,Duis aliquam convallis nunc. Proin at turpis a pede posuere nonummy. Integer non velit.
741,836,West-Bogan,Information Systems Manager,6,"Nam ultrices, libero non mattis pulvinar, nulla pede ullamcorper augue, a suscipit nulla elit ac nulla. Sed vel enim sit amet nunc viverra dapibus. Nulla suscipit ligula in lacus."
742,928,Hoeger-Harvey,Nurse,3,"Cras mi pede, malesuada in, imperdiet et, commodo vulputate, justo. In blandit ultrices enim. Lorem ipsum dolor sit amet, consectetuer adipiscing elit."
743,575,Conn Inc,Developer III,4,"Fusce posuere felis sed lacus. Morbi sem mauris, laoreet ut, rhoncus aliquet, pulvinar sed, nisl. Nunc rhoncus dui vel sem."
744,114,Gutmann LLC,Project Manager,2,"Quisque id justo sit amet sapien dignissim vestibulum. Vestibulum ante ipsum primis in faucibus orci luctus et ultrices posuere cubilia Curae; Nulla dapibus dolor vel est. Donec odio justo, sollicitudin ut, suscipit a, feugiat et, eros."
745,786,Bergnaum LLC,Project Manager,4,Phasellus in felis. Donec semper sapien a libero. Nam dui.
746,117,"Strosin, Hegmann and Wilkinson",Senior Editor,3,Duis bibendum. Morbi non quam nec dui luctus rutrum. Nulla tellus.
