ActivityID,JobSeekerID,OrganizationName,EAJobRole,EATimeRange,EADescription
454,660,Bauch LLC,Registered Nurse,6,"Curabitur at ipsum ac tellus semper interdum. Mauris ullamcorper purus sit amet nulla. Quisque arcu libero, rutrum ac, lobortis vel, dapibus at, diam."
455,205,Brown and Sons,Operator,2,"Sed sagittis. Nam congue, risus semper porta volutpat, quam pede lobortis ligula, sit amet eleifend pede libero quis orci. Nullam molestie nibh in lectus."
456,472,"Nitzsche, Wisozk and Walter",Environmental Specialist,4,"Sed sagittis. Nam congue, risus semper porta volutpat, quam pede lobortis ligula, sit amet eleifend pede libero quis orci. Nullam molestie nibh in lectus."
457,617,Walsh Group,Librarian,4,Phasellus sit amet erat. Nulla tempus. Vivamus in felis eu sapien cursus vestibulum.
458,317,"Mitchell, O'Conner and Hegmann",Physical Therapy Assistant,5,"Curabitur in libero ut massa volutpat convallis. Morbi odio odio, elementum eu, interdum eu, tincidunt in, leo. Maecenas pulvinar lobortis est."
459,275,Tillman-Grimes,Physical Therapy Assistant,4,"Mauris enim leo, rhoncus sed, vestibulum sit amet, cursus id, turpis. Integer aliquet, massa id lobortis convallis, tortor risus dapibus augue, vel accumsan tellus nisi eu orci. Mauris lacinia sapien quis libero."
460,244,Jaskolski Group,Accounting Assistant IV,3,Integer tincidunt ante vel ipsum. Praesent blandit lacinia erat. Vestibulum sed magna at nunc commodo placerat.
461,771,"Reichel, Daugherty and Labadie",Senior Quality Engineer,5,Praesent id massa id nisl venenatis lacinia. Aenean sit amet justo. Morbi ut odio.
462,149,Blick and Sons,Analog Circuit Design manager,5,"Mauris enim leo, rhoncus sed, vestibulum sit amet, cursus id, turpis. Integer aliquet, massa id lobortis convallis, tortor risus dapibus augue, vel accumsan tellus nisi eu orci. Mauris lacinia sapien quis libero."
463,423,Reinger-Bergstrom,Chief Design Engineer,6,Sed ante. Vivamus tortor. Duis mattis egestas metus.
464,111,"Weissnat, Hayes and Wisozk",Editor,5,"Curabitur in libero ut massa volutpat convallis. Morbi odio odio, elementum eu, interdum eu, tincidunt in, leo. Maecenas pulvinar lobortis est."
465,458,"Stiedemann, Ferry and Schowalter",VP Quality Control,5,"Morbi non lectus. Aliquam sit amet diam in magna bibendum imperdiet. Nullam orci pede, venenatis non, sodales sed, tincidunt eu, felis."
466,675,"Green, MacGyver and Macejkovic",Dental Hygienist,4,Phasellus sit amet erat. Nulla tempus. Vivamus in felis eu sapien cursus vestibulum.
467,716,Hessel-Ritchie,Food Chemist,1,"Mauris enim leo, rhoncus sed, vestibulum sit amet, cursus id, turpis. Integer aliquet, massa id lobortis convallis, tortor risus dapibus augue, vel accumsan tellus nisi eu orci. Mauris lacinia sapien quis libero."
468,945,Doyle-Dickens,Technical Writer,4,"Curabitur gravida nisi at nibh. In hac habitasse platea dictumst. Aliquam augue quam, sollicitudin vitae, consectetuer eget, rutrum at, lorem."
469,169,"Reilly, Dooley and Kshlerin",Executive Secretary,3,"Aenean fermentum. Donec ut mauris eget massa tempor convallis. Nulla neque libero, convallis eget, eleifend luctus, ultricies eu, nibh."
470,446,Kulas and Sons,Structural Analysis Engineer,5,"Duis bibendum, felis sed interdum venenatis, turpis enim blandit mi, in porttitor pede justo eu massa. Donec dapibus. Duis at velit eu est congue elementum."
471,405,Simonis-Gibson,Mechanical Systems Engineer,5,Phasellus sit amet erat. Nulla tempus. Vivamus in felis eu sapien cursus vestibulum.
472,656,Denesik Group,Staff Scientist,4,"Proin eu mi. Nulla ac enim. In tempor, turpis nec euismod scelerisque, quam turpis adipiscing lorem, vitae mattis nibh ligula nec sem."
473,395,Gottlieb and Sons,Compensation Analyst,4,Phasellus sit amet erat. Nulla tempus. Vivamus in felis eu sapien cursus vestibulum.
474,191,"Willms, Yost and Kihn",Recruiter,1,Phasellus in felis. Donec semper sapien a libero. Nam dui.
475,240,"Boyer, Cartwright and Bernhard",Account Representative III,3,"In sagittis dui vel nisl. Duis ac nibh. Fusce lacus purus, aliquet at, feugiat non, pretium quis, lectus."
476,806,Smith Inc,Junior Executive,4,Sed ante. Vivamus tortor. Duis mattis egestas metus.
477,400,Ryan LLC,GIS Technical Architect,1,"Maecenas tristique, est et tempus semper, est quam pharetra magna, ac consequat metus sapien ut nunc. Vestibulum ante ipsum primis in faucibus orci luctus et ultrices posuere cubilia Curae; Mauris viverra diam vitae quam. Suspendisse potenti."
478,649,Ortiz-Jast,Senior Quality Engineer,3,"Curabitur at ipsum ac tellus semper interdum. Mauris ullamcorper purus sit amet nulla. Quisque arcu libero, rutrum ac, lobortis vel, dapibus at, diam."
479,562,Pollich-Johnson,Sales Associate,5,"Quisque id justo sit amet sapien dignissim vestibulum. Vestibulum ante ipsum primis in faucibus orci luctus et ultrices posuere cubilia Curae; Nulla dapibus dolor vel est. Donec odio justo, sollicitudin ut, suscipit a, feugiat et, eros."
480,577,Wunsch-Greenfelder,Director of Sales,4,"Cras mi pede, malesuada in, imperdiet et, commodo vulputate, justo. In blandit ultrices enim. Lorem ipsum dolor sit amet, consectetuer adipiscing elit."
481,120,Cartwright Group,Tax Accountant,3,Pellentesque at nulla. Suspendisse potenti. Cras in purus eu magna vulputate luctus.
482,543,O'Reilly and Sons,Help Desk Operator,5,Integer tincidunt ante vel ipsum. Praesent blandit lacinia erat. Vestibulum sed magna at nunc commodo placerat.
483,73,Beatty Group,Teacher,3,Praesent id massa id nisl venenatis lacinia. Aenean sit amet justo. Morbi ut odio.
484,645,"Rowe, Skiles and McGlynn",Web Developer II,1,Phasellus in felis. Donec semper sapien a libero. Nam dui.
485,884,Wintheiser and Sons,Nurse Practicioner,1,Cras non velit nec nisi vulputate nonummy. Maecenas tincidunt lacus at velit. Vivamus vel nulla eget eros elementum pellentesque.
486,167,"Metz, Bosco and Fritsch",Marketing Manager,4,"Aenean fermentum. Donec ut mauris eget massa tempor convallis. Nulla neque libero, convallis eget, eleifend luctus, ultricies eu, nibh."
487,180,"Swift, Grant and Terry",Executive Secretary,4,"Vestibulum ac est lacinia nisi venenatis tristique. Fusce congue, diam id ornare imperdiet, sapien urna pretium nisl, ut volutpat sapien arcu sed augue. Aliquam erat volutpat."
488,701,Hegmann-Smitham,Systems Administrator II,3,Nullam porttitor lacus at turpis. Donec posuere metus vitae ipsum. Aliquam non mauris.
489,994,Fadel Group,Director of Sales,3,Cras non velit nec nisi vulputate nonummy. Maecenas tincidunt lacus at velit. Vivamus vel nulla eget eros elementum pellentesque.
490,40,Larkin-Braun,Project Manager,3,"Proin leo odio, porttitor id, consequat in, consequat ut, nulla. Sed accumsan felis. Ut at dolor quis odio consequat varius."
491,887,Jacobs Group,Cost Accountant,4,"Maecenas tristique, est et tempus semper, est quam pharetra magna, ac consequat metus sapien ut nunc. Vestibulum ante ipsum primis in faucibus orci luctus et ultrices posuere cubilia Curae; Mauris viverra diam vitae quam. Suspendisse potenti."
492,742,Koepp-Kertzmann,Assistant Professor,4,Suspendisse potenti. In eleifend quam a odio. In hac habitasse platea dictumst.
493,981,"Lemke, Quitzon and Block",Registered Nurse,2,"Lorem ipsum dolor sit amet, consectetuer adipiscing elit. Proin risus. Praesent lectus."
494,961,"Armstrong, Fay and Ernser",Community Outreach Specialist,5,"Duis bibendum, felis sed interdum venenatis, turpis enim blandit mi, in porttitor pede justo eu massa. Donec dapibus. Duis at velit eu est congue elementum."
495,391,Konopelski Group,Paralegal,6,Integer tincidunt ante vel ipsum. Praesent blandit lacinia erat. Vestibulum sed magna at nunc commodo placerat.
496,751,Armstrong LLC,Project Manager,4,"Duis bibendum, felis sed interdum venenatis, turpis enim blandit mi, in porttitor pede justo eu massa. Donec dapibus. Duis at velit eu est congue elementum."
497,717,Jakubowski and Sons,Computer Systems Analyst I,5,"Sed sagittis. Nam congue, risus semper porta volutpat, quam pede lobortis ligula, sit amet eleifend pede libero quis orci. Nullam molestie nibh in lectus."
498,855,Robel-Feeney,Food Chemist,4,Sed ante. Vivamus tortor. Duis mattis egestas metus.
499,504,Moen-Willms,Structural Engineer,3,Duis bibendum. Morbi non quam nec dui luctus rutrum. Nulla tellus.
500,308,Lang Group,Help Desk Technician,3,Suspendisse potenti. In eleifend quam a odio. In hac habitasse platea dictumst.
501,34,"Murphy, Smith and Schimmel",Recruiter,6,Praesent id massa id nisl venenatis lacinia. Aenean sit amet justo. Morbi ut odio.
502,299,Von-Vandervort,Sales Representative,3,"Mauris enim leo, rhoncus sed, vestibulum sit amet, cursus id, turpis. Integer aliquet, massa id lobortis convallis, tortor risus dapibus augue, vel accumsan tellus nisi eu orci. Mauris lacinia sapien quis libero."
503,178,"McDermott, Barton and Lemke",Tax Accountant,2,Maecenas ut massa quis augue luctus tincidunt. Nulla mollis molestie lorem. Quisque ut erat.
504,425,"Abernathy, Bednar and Botsford",Office Assistant II,4,"Curabitur at ipsum ac tellus semper interdum. Mauris ullamcorper purus sit amet nulla. Quisque arcu libero, rutrum ac, lobortis vel, dapibus at, diam."
505,338,"Davis, Runte and Kuvalis",Editor,1,Phasellus sit amet erat. Nulla tempus. Vivamus in felis eu sapien cursus vestibulum.
506,414,"White, Conroy and Kilback",Technical Writer,1,Maecenas ut massa quis augue luctus tincidunt. Nulla mollis molestie lorem. Quisque ut erat.
507,345,Tromp-Ruecker,Physical Therapy Assistant,2,"Nam ultrices, libero non mattis pulvinar, nulla pede ullamcorper augue, a suscipit nulla elit ac nulla. Sed vel enim sit amet nunc viverra dapibus. Nulla suscipit ligula in lacus."
508,954,"Lang, Weber and Roberts",Research Associate,3,"Morbi non lectus. Aliquam sit amet diam in magna bibendum imperdiet. Nullam orci pede, venenatis non, sodales sed, tincidunt eu, felis."
509,177,Keebler Inc,Registered Nurse,5,"Duis bibendum, felis sed interdum venenatis, turpis enim blandit mi, in porttitor pede justo eu massa. Donec dapibus. Duis at velit eu est congue elementum."
510,428,Medhurst LLC,Accountant III,6,Duis bibendum. Morbi non quam nec dui luctus rutrum. Nulla tellus.
511,229,"Kiehn, Wolff and Bins",Help Desk Technician,4,"Quisque porta volutpat erat. Quisque erat eros, viverra eget, congue eget, semper rutrum, nulla. Nunc purus."
512,771,Hayes and Sons,Legal Assistant,6,"Quisque id justo sit amet sapien dignissim vestibulum. Vestibulum ante ipsum primis in faucibus orci luctus et ultrices posuere cubilia Curae; Nulla dapibus dolor vel est. Donec odio justo, sollicitudin ut, suscipit a, feugiat et, eros."
513,983,"Leffler, Larkin and Rolfson",Assistant Manager,6,In congue. Etiam justo. Etiam pretium iaculis justo.
514,851,Kreiger-King,Executive Secretary,2,Phasellus sit amet erat. Nulla tempus. Vivamus in felis eu sapien cursus vestibulum.
515,174,Kohler-Kihn,Senior Quality Engineer,6,Integer ac leo. Pellentesque ultrices mattis odio. Donec vitae nisi.
516,725,Reichel Group,Nurse,3,Duis consequat dui nec nisi volutpat eleifend. Donec ut dolor. Morbi vel lectus in quam fringilla rhoncus.
517,439,Abbott-Crooks,VP Quality Control,3,"Donec diam neque, vestibulum eget, vulputate ut, ultrices vel, augue. Vestibulum ante ipsum primis in faucibus orci luctus et ultrices posuere cubilia Curae; Donec pharetra, magna vestibulum aliquet ultrices, erat tortor sollicitudin mi, sit amet lobortis sapien sapien non mi. Integer ac neque."
518,972,Harris and Sons,Recruiting Manager,5,"Mauris enim leo, rhoncus sed, vestibulum sit amet, cursus id, turpis. Integer aliquet, massa id lobortis convallis, tortor risus dapibus augue, vel accumsan tellus nisi eu orci. Mauris lacinia sapien quis libero."
519,128,Schulist and Sons,Senior Quality Engineer,3,"Donec diam neque, vestibulum eget, vulputate ut, ultrices vel, augue. Vestibulum ante ipsum primis in faucibus orci luctus et ultrices posuere cubilia Curae; Donec pharetra, magna vestibulum aliquet ultrices, erat tortor sollicitudin mi, sit amet lobortis sapien sapien non mi. Integer ac neque."
520,736,Fay-O'Reilly,Staff Scientist,4,"Curabitur at ipsum ac tellus semper interdum. Mauris ullamcorper purus sit amet nulla. Quisque arcu libero, rutrum ac, lobortis vel, dapibus at, diam."
521,281,"Mante, Weber and Schneider",Senior Developer,5,"In hac habitasse platea dictumst. Morbi vestibulum, velit id pretium iaculis, diam erat fermentum justo, nec condimentum neque sapien placerat ante. Nulla justo."
522,857,Reynolds Group,Office Assistant III,6,Phasellus in felis. Donec semper sapien a libero. Nam dui.
523,637,Kutch and Sons,Nuclear Power Engineer,6,"Cras mi pede, malesuada in, imperdiet et, commodo vulputate, justo. In blandit ultrices enim. Lorem ipsum dolor sit amet, consectetuer adipiscing elit."
524,843,Ziemann Inc,Recruiting Manager,6,"Quisque porta volutpat erat. Quisque erat eros, viverra eget, congue eget, semper rutrum, nulla. Nunc purus."
525,318,"Zboncak, Lynch and Ward",Director of Sales,3,"Duis bibendum, felis sed interdum venenatis, turpis enim blandit mi, in porttitor pede justo eu massa. Donec dapibus. Duis at velit eu est congue elementum."
526,512,Kshlerin Group,Web Developer IV,4,Praesent id massa id nisl venenatis lacinia. Aenean sit amet justo. Morbi ut odio.
527,737,"Wisoky, McLaughlin and Krajcik",Food Chemist,3,"In hac habitasse platea dictumst. Morbi vestibulum, velit id pretium iaculis, diam erat fermentum justo, nec condimentum neque sapien placerat ante. Nulla justo."
528,91,Crooks and Sons,Quality Engineer,1,Phasellus sit amet erat. Nulla tempus. Vivamus in felis eu sapien cursus vestibulum.
529,567,"Morissette, Nolan and Heller",GIS Technical Architect,1,Nullam sit amet turpis elementum ligula vehicula consequat. Morbi a ipsum. Integer a nibh.
530,62,Hackett-Brekke,Safety Technician III,5,Pellentesque at nulla. Suspendisse potenti. Cras in purus eu magna vulputate luctus.
531,152,Hagenes and Sons,Physical Therapy Assistant,3,In congue. Etiam justo. Etiam pretium iaculis justo.
532,525,Boehm-Abernathy,Desktop Support Technician,2,Fusce consequat. Nulla nisl. Nunc nisl.
533,710,"Sawayn, Monahan and Murray",Engineer III,4,Integer ac leo. Pellentesque ultrices mattis odio. Donec vitae nisi.
534,332,Erdman-Kris,Software Engineer II,1,Aliquam quis turpis eget elit sodales scelerisque. Mauris sit amet eros. Suspendisse accumsan tortor quis turpis.
535,63,Williamson and Sons,Payment Adjustment Coordinator,3,"Donec diam neque, vestibulum eget, vulputate ut, ultrices vel, augue. Vestibulum ante ipsum primis in faucibus orci luctus et ultrices posuere cubilia Curae; Donec pharetra, magna vestibulum aliquet ultrices, erat tortor sollicitudin mi, sit amet lobortis sapien sapien non mi. Integer ac neque."
536,55,"Kunze, Walter and Runte",Programmer Analyst IV,3,"Cum sociis natoque penatibus et magnis dis parturient montes, nascetur ridiculus mus. Vivamus vestibulum sagittis sapien. Cum sociis natoque penatibus et magnis dis parturient montes, nascetur ridiculus mus."
537,483,Wunsch and Sons,Pharmacist,3,"Quisque id justo sit amet sapien dignissim vestibulum. Vestibulum ante ipsum primis in faucibus orci luctus et ultrices posuere cubilia Curae; Nulla dapibus dolor vel est. Donec odio justo, sollicitudin ut, suscipit a, feugiat et, eros."
538,239,"McKenzie, Schultz and Kilback",Analog Circuit Design manager,5,In hac habitasse platea dictumst. Etiam faucibus cursus urna. Ut tellus.
539,946,Kuhn LLC,Assistant Manager,1,"Donec diam neque, vestibulum eget, vulputate ut, ultrices vel, augue. Vestibulum ante ipsum primis in faucibus orci luctus et ultrices posuere cubilia Curae; Donec pharetra, magna vestibulum aliquet ultrices, erat tortor sollicitudin mi, sit amet lobortis sapien sapien non mi. Integer ac neque."
540,575,Kessler-Abshire,Account Coordinator,4,"Nam ultrices, libero non mattis pulvinar, nulla pede ullamcorper augue, a suscipit nulla elit ac nulla. Sed vel enim sit amet nunc viverra dapibus. Nulla suscipit ligula in lacus."
541,405,"Gleason, Braun and Pfannerstill",Computer Systems Analyst II,6,Etiam vel augue. Vestibulum rutrum rutrum neque. Aenean auctor gravida sem.
542,164,"Howe, Ward and Brown",Geologist II,3,In congue. Etiam justo. Etiam pretium iaculis justo.
543,25,Wisozk-Volkman,Tax Accountant,2,"Cum sociis natoque penatibus et magnis dis parturient montes, nascetur ridiculus mus. Vivamus vestibulum sagittis sapien. Cum sociis natoque penatibus et magnis dis parturient montes, nascetur ridiculus mus."
544,805,"Mohr, Weimann and O'Hara",Associate Professor,4,In quis justo. Maecenas rhoncus aliquam lacus. Morbi quis tortor id nulla ultrices aliquet.
545,667,Schuster and Sons,Nuclear Power Engineer,3,Praesent id massa id nisl venenatis lacinia. Aenean sit amet justo. Morbi ut odio.
546,786,"Sipes, Daniel and Torp",Software Consultant,1,"Maecenas tristique, est et tempus semper, est quam pharetra magna, ac consequat metus sapien ut nunc. Vestibulum ante ipsum primis in faucibus orci luctus et ultrices posuere cubilia Curae; Mauris viverra diam vitae quam. Suspendisse potenti."
547,365,Bogan-Daniel,Junior Executive,6,"Curabitur gravida nisi at nibh. In hac habitasse platea dictumst. Aliquam augue quam, sollicitudin vitae, consectetuer eget, rutrum at, lorem."
548,712,"White, Reinger and Waters",Analyst Programmer,5,In hac habitasse platea dictumst. Etiam faucibus cursus urna. Ut tellus.
549,940,Wilderman-Boyer,Accounting Assistant III,1,Duis bibendum. Morbi non quam nec dui luctus rutrum. Nulla tellus.
550,336,Larkin-Bergstrom,Structural Engineer,2,"Proin eu mi. Nulla ac enim. In tempor, turpis nec euismod scelerisque, quam turpis adipiscing lorem, vitae mattis nibh ligula nec sem."
551,100,Parisian-Senger,Paralegal,2,"Vestibulum quam sapien, varius ut, blandit non, interdum in, ante. Vestibulum ante ipsum primis in faucibus orci luctus et ultrices posuere cubilia Curae; Duis faucibus accumsan odio. Curabitur convallis."
552,865,Rau-Kunde,VP Marketing,1,"Fusce posuere felis sed lacus. Morbi sem mauris, laoreet ut, rhoncus aliquet, pulvinar sed, nisl. Nunc rhoncus dui vel sem."
553,676,Jenkins-Wintheiser,Librarian,1,Nulla ut erat id mauris vulputate elementum. Nullam varius. Nulla facilisi.
554,797,"Cummerata, Marquardt and Ferry",VP Sales,3,"Morbi non lectus. Aliquam sit amet diam in magna bibendum imperdiet. Nullam orci pede, venenatis non, sodales sed, tincidunt eu, felis."
555,407,"Ruecker, McGlynn and Cronin",Tax Accountant,6,"Quisque porta volutpat erat. Quisque erat eros, viverra eget, congue eget, semper rutrum, nulla. Nunc purus."
556,926,Schmidt Group,Physical Therapy Assistant,3,Nullam porttitor lacus at turpis. Donec posuere metus vitae ipsum. Aliquam non mauris.
557,764,Bode-Reichert,Marketing Manager,3,Nullam porttitor lacus at turpis. Donec posuere metus vitae ipsum. Aliquam non mauris.
558,248,"Little, Mraz and Steuber",Research Associate,3,"Proin interdum mauris non ligula pellentesque ultrices. Phasellus id sapien in sapien iaculis congue. Vivamus metus arcu, adipiscing molestie, hendrerit at, vulputate vitae, nisl."
559,355,Feest and Sons,Professor,3,"Maecenas tristique, est et tempus semper, est quam pharetra magna, ac consequat metus sapien ut nunc. Vestibulum ante ipsum primis in faucibus orci luctus et ultrices posuere cubilia Curae; Mauris viverra diam vitae quam. Suspendisse potenti."
560,77,Balistreri LLC,Quality Control Specialist,6,Duis aliquam convallis nunc. Proin at turpis a pede posuere nonummy. Integer non velit.
561,626,Durgan-Boehm,Civil Engineer,2,"Fusce posuere felis sed lacus. Morbi sem mauris, laoreet ut, rhoncus aliquet, pulvinar sed, nisl. Nunc rhoncus dui vel sem."
562,216,"Emard, Kunde and Miller",Structural Analysis Engineer,3,Integer tincidunt ante vel ipsum. Praesent blandit lacinia erat. Vestibulum sed magna at nunc commodo placerat.
563,333,Weissnat Inc,Cost Accountant,6,"Quisque id justo sit amet sapien dignissim vestibulum. Vestibulum ante ipsum primis in faucibus orci luctus et ultrices posuere cubilia Curae; Nulla dapibus dolor vel est. Donec odio justo, sollicitudin ut, suscipit a, feugiat et, eros."
564,873,"Cummerata, Heller and Crist",Civil Engineer,6,Praesent id massa id nisl venenatis lacinia. Aenean sit amet justo. Morbi ut odio.
565,802,Fadel-Hilpert,Staff Accountant II,1,"Donec diam neque, vestibulum eget, vulputate ut, ultrices vel, augue. Vestibulum ante ipsum primis in faucibus orci luctus et ultrices posuere cubilia Curae; Donec pharetra, magna vestibulum aliquet ultrices, erat tortor sollicitudin mi, sit amet lobortis sapien sapien non mi. Integer ac neque."
566,283,Lehner-Grimes,Database Administrator II,4,"Proin interdum mauris non ligula pellentesque ultrices. Phasellus id sapien in sapien iaculis congue. Vivamus metus arcu, adipiscing molestie, hendrerit at, vulputate vitae, nisl."
567,174,"Glover, Baumbach and Denesik",Editor,5,Praesent id massa id nisl venenatis lacinia. Aenean sit amet justo. Morbi ut odio.
568,15,"Feest, Hintz and Johnson",Senior Financial Analyst,6,"Lorem ipsum dolor sit amet, consectetuer adipiscing elit. Proin risus. Praesent lectus."
569,477,"Hodkiewicz, Lakin and Thiel",Recruiter,4,"Maecenas tristique, est et tempus semper, est quam pharetra magna, ac consequat metus sapien ut nunc. Vestibulum ante ipsum primis in faucibus orci luctus et ultrices posuere cubilia Curae; Mauris viverra diam vitae quam. Suspendisse potenti."
570,155,O'Reilly-O'Conner,Technical Writer,1,"Proin interdum mauris non ligula pellentesque ultrices. Phasellus id sapien in sapien iaculis congue. Vivamus metus arcu, adipiscing molestie, hendrerit at, vulputate vitae, nisl."
571,374,"Gerhold, Ebert and Willms",Pharmacist,6,"Vestibulum quam sapien, varius ut, blandit non, interdum in, ante. Vestibulum ante ipsum primis in faucibus orci luctus et ultrices posuere cubilia Curae; Duis faucibus accumsan odio. Curabitur convallis."
572,13,Kemmer and Sons,Sales Representative,3,Etiam vel augue. Vestibulum rutrum rutrum neque. Aenean auctor gravida sem.
573,911,Greenfelder and Sons,Engineer III,2,Fusce consequat. Nulla nisl. Nunc nisl.
574,100,Tremblay-Russel,Speech Pathologist,6,In hac habitasse platea dictumst. Etiam faucibus cursus urna. Ut tellus.
575,665,"Bechtelar, Konopelski and D'Amore",Software Consultant,3,"Lorem ipsum dolor sit amet, consectetuer adipiscing elit. Proin risus. Praesent lectus."
576,741,Purdy LLC,Automation Specialist III,2,Duis consequat dui nec nisi volutpat eleifend. Donec ut dolor. Morbi vel lectus in quam fringilla rhoncus.
577,655,Cole LLC,Software Engineer III,4,"In hac habitasse platea dictumst. Morbi vestibulum, velit id pretium iaculis, diam erat fermentum justo, nec condimentum neque sapien placerat ante. Nulla justo."
578,885,Volkman Group,Business Systems Development Analyst,4,Sed ante. Vivamus tortor. Duis mattis egestas metus.
579,11,"Rogahn, Shields and Wiza",Senior Editor,2,Nulla ut erat id mauris vulputate elementum. Nullam varius. Nulla facilisi.
580,383,Parisian-Kihn,Nurse,6,Aenean lectus. Pellentesque eget nunc. Donec quis orci eget orci vehicula condimentum.
581,535,Yundt and Sons,Senior Editor,5,"Sed sagittis. Nam congue, risus semper porta volutpat, quam pede lobortis ligula, sit amet eleifend pede libero quis orci. Nullam molestie nibh in lectus."
582,570,"Bauch, Jones and Kozey",Clinical Specialist,1,"Morbi porttitor lorem id ligula. Suspendisse ornare consequat lectus. In est risus, auctor sed, tristique in, tempus sit amet, sem."
583,637,Hessel-Ullrich,Accountant IV,1,"Quisque id justo sit amet sapien dignissim vestibulum. Vestibulum ante ipsum primis in faucibus orci luctus et ultrices posuere cubilia Curae; Nulla dapibus dolor vel est. Donec odio justo, sollicitudin ut, suscipit a, feugiat et, eros."
584,522,Beier-Kuphal,Sales Representative,5,Nullam porttitor lacus at turpis. Donec posuere metus vitae ipsum. Aliquam non mauris.
585,121,"Cremin, Bode and Hansen",Developer III,3,"Maecenas tristique, est et tempus semper, est quam pharetra magna, ac consequat metus sapien ut nunc. Vestibulum ante ipsum primis in faucibus orci luctus et ultrices posuere cubilia Curae; Mauris viverra diam vitae quam. Suspendisse potenti."
586,54,Dickens and Sons,VP Product Management,5,"Fusce posuere felis sed lacus. Morbi sem mauris, laoreet ut, rhoncus aliquet, pulvinar sed, nisl. Nunc rhoncus dui vel sem."
587,983,"Fadel, Conroy and Reichel",Systems Administrator I,3,Suspendisse potenti. In eleifend quam a odio. In hac habitasse platea dictumst.
588,476,Reynolds-Botsford,Financial Advisor,6,Pellentesque at nulla. Suspendisse potenti. Cras in purus eu magna vulputate luctus.
589,660,"Bailey, Aufderhar and Wolf",Account Executive,6,Maecenas ut massa quis augue luctus tincidunt. Nulla mollis molestie lorem. Quisque ut erat.
590,776,Barrows-Streich,Junior Executive,1,"In sagittis dui vel nisl. Duis ac nibh. Fusce lacus purus, aliquet at, feugiat non, pretium quis, lectus."
591,138,Hilll-Jakubowski,Media Manager I,2,Praesent id massa id nisl venenatis lacinia. Aenean sit amet justo. Morbi ut odio.
592,234,O'Conner-Hackett,Environmental Specialist,4,"Cras mi pede, malesuada in, imperdiet et, commodo vulputate, justo. In blandit ultrices enim. Lorem ipsum dolor sit amet, consectetuer adipiscing elit."
593,343,Luettgen-Jerde,Senior Cost Accountant,6,"Donec diam neque, vestibulum eget, vulputate ut, ultrices vel, augue. Vestibulum ante ipsum primis in faucibus orci luctus et ultrices posuere cubilia Curae; Donec pharetra, magna vestibulum aliquet ultrices, erat tortor sollicitudin mi, sit amet lobortis sapien sapien non mi. Integer ac neque."
594,71,Kuvalis-Roberts,Programmer Analyst III,4,Phasellus sit amet erat. Nulla tempus. Vivamus in felis eu sapien cursus vestibulum.
